date,headline,summary
2022-05-26,State of DeFi: Should Chainlink Oracles Be of Concern?,"As the collapse of Terra's ecosystem poses contagion risks across DeFi land, ""Proof of Decentralization"" Podcast Host Chris Blec unpacks the vulnerabilities and potential consequences of Chainlink oracles relying on multisig and how it could bring down all of DeFi. ""This is an intentional point of control that the Chainlink team chose to keep in the protocol,"" Blec said."
2022-05-27,Chainlink Response to Multi-Sig Security Protocol,"Yesterday, ""Proof of Decentralization"" podcast host Chris Blec joined ""First Mover"" to discuss the potential security risks of Chainlink's multi-signature protocol. A spokesperson for Chainlink has since published a statement saying the latest change went into effect May 23, clarifying the multi-sig safe has a 4-of-9 signing threshold, and not 3-of-20 as Blec noted. ""First Mover"" hosts present Chainlink's response."
2022-06-03,Chainlink Price Feeds Now Live on Solana,The first non-EVM chain supported by Chainlink will offer seven price feeds for the Solana DeFi ecosystem.
2022-06-15,Chainlink Price Feeds Are Live on Polkadot-Based Moonbeam,Oracle application Chainlink now supports the most active decentralized application (dApp) ecosystem on Polkadot.
2022-06-22,Consensus 2022 Foundations: Chainlink,"""Chainlink Co-founder Sergey Nazarov discusses the network's evolution as a cryptographic truth source and how they expand the capabilities of smart contracts while maintaining the on-chain security, followed by a Q&A with Lattice Capital's General Partner Mike Zajko.

Plus, Chainlink Labs Head of Developer Relations Stephen Fluin's analysis on the network's technology.

Richard Gottleber, Chainlink Labs Developer Advocate, demonstrates the operation of smart contracts, and the session ends on a conversation between Dez Bryant (Personal Corner) and Lauren Halstead (Chainlink) about athletes, fans, and crypto."""
2022-06-28,LINK Rallies as Much as 8% After Listing on Robinhood,It was the first time Robinhood has listed a new token since mid-April.
2022-06-29,Chainlink’s Smart Contract Products Go Live on Fantom,"Two protocols, Keepers and VRF, will allow developers to deploy more sophisticated applications on the Fantom network."
2022-09-27,Galaxy Digital Offers Crypto Price Data on Chain Via Chainlink,"Crypto price data will help developers build out their platforms, Galaxy’s head of strategic opportunities said."
2022-09-28,SWIFT Partners With Crypto Data Provider Chainlink on Cross-Chain Protocol in TradFi Play,"Interest from institutional investors moving into crypto has been “undeniable,” according to SWIFT’s Strategy Director."
2022-09-28,Blockchain Data Provider Chainlink Launches Programs to Reduce Costs Ahead of Staking of Its Token,"The popular blockchain oracle network’s new “Build” and “Scale” programs set the stage for the LINK token staking to begin in December 2022, said cofounder Sergey Nazarov."
2022-10-05,Hedge Fund Two Sigma to Provide Data to Blockchain Information Network Chainlink,"The massive fund, which manages about $60 billion in assets, will provide derivatives-related data to Chainlink."
2022-11-02,SWIFT Is Partnering With Chainlink: Here’s the Down-low on the Blockchain Data Provider,Chainlink said it is helping Belgium-based SWIFT make token transfers and communicate across all blockchain environments.
2022-11-17,‘Proof of Reserves’ Emerges as a Favored Way to Prevent Another FTX,"Several exchanges, including Binance, have announced plans to use the auditing technique to reassure customers."
2022-12-05,Chainlink ‘Smart Money’ Might Be Pulling LINK Tokens Off Exchanges to Stake Them,The price of LINK is up 28% in the past two weeks.
2022-12-06,Blockchain Data Provider Chainlink Launches Staking of Its Native Token LINK,"Staking will provide incentives that will enable the Chainlink system to grow, according to co-founder Sergey Nazarov."
2022-12-07,Chainlink Staking Opens With Initial $51M Inflow,"Staking started Tuesday, and 7 million LINK tokens were locked in the first 30 minutes to secure the network."
2022-12-08,"Chainlink’s First Staking Pool Pulls in $170M of LINK Tokens, Hitting Community Limit After 2 Days","Staking started Tuesday, and 24.27 million LINK tokens were locked in by Thursday to secure the network."
2022-12-12,Chainlink Whale ‘Oldwhite’ Used More Than 150 Wallets to Avoid Staking Limits,"The crypto wallet labeled “Oldwhite” on OpenSea is connected to over 1 million staked LINK tokens, blockchain data shows, even though Chainlink officials tried to get ""greater inclusion"" from a broad base of participants by limiting each wallet to 7,000 LINK tokens."
2022-12-22,Aave DAO Votes to Integrate Chainlink Proof of Reserves to Tighten Network Security,"Although the decentralized lending protocol’s data is inherently on-chain, introducing Chainlink’s PoR would help mitigate the risk of attacks on the Aave protocol."
2023-02-06,StarkWare Partnering With Chainlink for StarkNet Growth,The provider of blockchain scaling products will integrate the data provider’s price feeds.
2023-02-09,DeFi Giant MakerDAO Integrates Blockchain Data Provider Chainlink for DAI Stablecoin,"Chainlink Automation will run specific tasks, including price updates and liquidity balancing, to help maintain the stability of Maker’s $5 billion DAI stablecoin."
2023-02-22,"Chainlink, TrueUSD Start Real-Time ‘Mint Lock’ Verification of Stablecoin Reserves",The key is to get information from the bank account where the stablecoin’s reserves are kept to the blockchain-based smart contract that controls issuance of new TUSD.
2023-02-28,"Crypto Broker Voyager Digital Sends $121M in Crypto to Exchanges, Sells Ether, Shiba Inu Holdings","Blockchain transaction data by Arkham Intelligence shows Voyager Digital transferred some $121 million of crypto assets to exchanges in February and received some $150 million in USDC stablecoins in the last four days, likely proceeds from sales."
2023-03-01,Chainlink Launches Platform to Help Web2 Connect With Smart Contracts,The beta version of Chainlink Functions is now live on the Ethereum Sepolia and Polygon Mumbai test networks.
2023-03-03,"Chainlink Price Feeds Go Live on Base, Coinbase’s Layer 2 Testnet","Base also joins the Web3 services platform's Scale program, allowing developers to construct smart contracts that can react to external information at a subsidized cost."
2023-04-25,Decentralized Exchange GMX Connects to Chainlink's Low-Latency Oracles Following Community Vote,"GMX is the largest protocol on Arbitrum, with $567 million in total value locked."
2023-04-25,Celo Joins Chainlink Program Giving Developers Access to Data Feeds,More than 90 Celo community members voted in favor of joining the Chainlink Scale program while three voted to not join.
2023-05-18,Coinbase Cloud Joins Chainlink as Node Operator to Bolster Security,"Telecoms giants Swisscom, Deutsche Telekom and news provider Associated Press are also Chainlink node operators."
2023-06-06,Swift and Chainlink Will Test Connecting Over a Dozen Financial Institutions to Blockchain Networks,"In a new set of experiments, Swift will collaborate with major financial market institutions like the Depository Trust and Clearing Corporation (DTCC), Australia and New Zealand Banking Group Limited (ANZ), BNP Paribas, BNY Mellon, Citi, Clearstream, Euroclear and Lloyds Banking Group."
2023-06-28,Chainlink Data Feeds Go Live on Celo,"In April, Celo joined Chainlink Scale to access the data provider’s oracle services at a low cost."
2023-07-05,"Chainlink ‘Proof of Reserve’ Proves Little Beyond Data Going In, Coming Out","Projects like TrueUSD and Paxos are turning to Chainlink to give users transparency into their reserves, but their numbers remain difficult to verify."
2023-07-06,Unpacking Chainlink's Proof-of-Reserves Service,"CoinDesk Deputy Managing Editor for Tech and Protocols Sam Kessler takes a deep dive into Chainlink's proof-of-reserves service and whether these efforts at transparency are a step in the right direction, or are merely setting up an illusion of decentralization in a fundamentally trust-based system."
2023-07-17,"Chainlink's Interoperability Protocol, Connecting Blockchains to ‘Bank Chains,’ Goes Live","This is the launch of the standard that could connect all of the blockchains and all of the bank chains, Sergey Nazarov said in an interview with CoinDesk."
2023-07-20,Chainlink’s LINK Climbs as Whales Add to Holdings Following Protocol Release,"The CCIP protocol is designed to help build cross-chain applications and services and went live for early access users on the Avalanche, Ethereum, Optimism and Polygon blockchains this week."
2023-07-20,"Chainlink’s LINK Pops 15%, XRP Loses Steam as Bitcoin Revisits $29.6K Range Lows","Tech stocks such as Tesla and Netflix, which crypto prices tend to correlate with, sold off during the day as investors shied away from risk assets."
2023-07-26,A Wall Street (Crypto) Analyst’s Take on ChainLink: Crypto Long & Short,"If the LINK token were a stock, here’s what an analyst might say."
2023-08-31,"Swift, Chainlink Tokenization Experiment Successfully Transfers Value Across Multiple Blockchains",The interbank messaging system Swift announced in June it was collaborating with Chainlink and dozens of financial institutions to test connecting blockchains.
2023-09-18,"Chainlink’s LINK Soars, Outperforming Other Crypto Majors",The uptick comes as the company has secured a number of notable partnerships with traditional finance institutions.
2023-09-28,Banking Giants Abuzz About Tokenization of Real-World Assets as DeFi Craves Collateral,"JPMorgan, Citi and Franklin Templeton are digitizing traditional assets. Will they end up trading on crypto networks like Ethereum?"
2023-09-29,Chainlink Co-Founder Sergey Nazarov: Adoption Will 'Skyrocket' For Banks Once Legal Clarity Comes,"Chainlink co-founder Sergey Nazarov spoke to CoinDesk managing editor Aoyon Ashraf during the Sibos 2023 conference in Toronto, Canada. “As the legal clarity comes, the amount of adoption, I think, will skyrocket. Because that’s the only thing that I really see holding banks back,” Nazarov said. Travis Detweiler from OPUS filmed this interview."
2023-09-29,"Sergey Nazarov on What’s Next for Chainlink, Future of Tokenizing Real World Assets","Chainlink co-founder Sergey Nazarov spoke to CoinDesk managing editor Aoyon Ashraf during the Sibos 2023 conference in Toronto, Canada. The wide-ranging interview covers Nazarov’s thoughts on cross-chain interoperability protocol (CCIP), TradFi partnerships and tokenizing real world assets. Travis Detweiler from OPUS filmed this interview."
2023-10-02,"Chainlink Unveils ‘Data Streams’ to Reduce Latency, Expands Decentralized Computing",The company launched Chainlink Data Streams and announced new decentralized computing capabilities.
2023-10-04,"Crypto vs. Banks? It’s Not Either-Or for Chainlink, Ripple","Rather than attempting to disrupt banks and other traditional payments systems, these high-profile blockchain developers are looking to court their business."
2023-10-11,Chainlink’s LINK Is ‘Safest Bet’ to Profit From RWA Tokenization Trend: K33 Research,Chainlink has positioned itself as a key piece of infrastructure to connect blockchains with the outside world and should profit from crypto’s real-world asset narrative.
2023-10-23,Large Crypto Trader's $7M LINK Deposits to Binance Signals Profit-Taking as Token Hits 17-Month High,"LINK surged 9% to $11 Monday, posting one of the best monthly returns among large-cap cryptocurrencies with a 43% gain."
2023-10-25,"Vodafone, Chainlink Show Blockchain Can Support Global Trade Processes","The proof of concept enabled devices to act autonomously and produce accurate information to support trade document exchange, the companies said."
2023-10-26,"FTX Moves Millions Worth of LINK, MATIC, AGLD to Coinbase as Sam Bankman-Fried Testifies",The latest transactions followed $19 million worth of crypto moved from FTX cold wallets to exchanges.
2023-11-06,"Crypto Funds See $767M Six-Week Inflow, Best Since 2021 Bull Market: CoinShares","Bitcoin funds attracted most of the demand, while ether funds saw their largest inflows since August 2022."
2023-11-08,"Grayscale Chainlink Trust Zooms to 200% Premium, Indicating Institutional Demand for LINK",The trust is one of the only ways for institutional investors to gain exposure to LINK tokens through a regulated product.
2023-11-08,Bitcoin Breakout Toward $45K 'Imminent' Says Matrixport,Polygon's MATIC and Chainlink's LINK led altcoin gains Wednesday afternoon.
2023-11-20,The PYTH Airdrop Is Finally Here. But What Is Pyth Network?,Pyth Network's speed-focused oracle service aims to challenge Chainlink as the go-to data source for blockchain finance.
2023-12-04,Sergey Nazarov: The Crypto Oracle,"Chainlink is where digital assets meet the real world, and Nazarov is predicting TradFi and crypto will become intertwined."
2023-12-05,Pyth Oracle Network Brings Industry Heavyweights Into Governance Post-Airdrop,"The low-latency oracle network's new ""strategic partners"" include Castle Island Ventures, Multicoin Capital and Wintermute Ventures. They could play a major role in shaping how the platform evolves."
2023-12-08,"Chainlink Staking Program Quickly Pulls in $600M, Hitting Limit; LINK Jumps 12%","The blockchain-oracle project's ""v0.2"" staking program expanded the capacity to 45M LINK tokens from 25M, and the portion reserved for the community quickly filled up. The LINK token surged in price."
2023-12-14,Chainlink Data Feeds Available on Polygon zkEVM,Developers building on Polygon’s zkEVM will be able to incorporate these data feeds into their on-chain applications.
2024-01-16,Chainlink Teams Up With Circle to Allow Cross-Chain Stablecoin Transfers,The integration allows developers to build cross-chain use cases via Chainlink's CCIP that involve multichain transfers of Circle's USDC stablecoin.
2024-02-02,"Chainlink's LINK Token Taps 22-Month High of $18, Ending Three-Month Breather",Analysts consider LINK as the safest bet to profit from the tokenization narrative.
2024-02-02,Chainlink's LINK Token Notches 22-Month High,"Chainlink's (LINK) surged to a 22-month high on Friday, ending a three-month bull breather for the token of the leading decentralized oracle network. This comes as the CoinDesk 20 Index, which measures the performance of the largest 20 digital assets by market capitalization from the CoinDesk Market Index (CMI), is finishing the week in the green. CoinDesk's Jennifer Sanasie presents ""The Chart of the Day."""
2024-02-05,Bitcoin Floats Above $43K as 'Buy The Dip' Sentiment Prevails,"Buying on dips remains the dominant tactic in the crypto market, one trader said."
2024-02-05,Bitcoin Slips Towards $42K as Interest Rates Soar; Chainlink's LINK Defies Crypto Slump,"Federal Reserve Chair Jerome Powell reiterated his hawkish stance on rate cuts in a Sunday interview, weighing on risk assets."
2024-02-07,Whales Grab $50M of Chainlink’s LINK as Price Climbs 40% in a Month,"LINK is one of the year's top-performing tokens, driven largely by hype around the tokenization of real-world assets."
2024-02-07,SEC Punts Again on Spot Ether ETF Decision; Legal Battle Over Bitcoin Heats Up,"""CoinDesk Daily"" host Jennifer Sanasie breaks down some of the biggest headlines impacting the world of crypto today, including a decision for approving or denying a joint Ether ETF product being pushed back. A trial to sort out Craig Wright's claims to be Bitcoin creator Satoshi Nakamoto has begun in a U.K. court. And, interest in tokenization of real-world assets has sparked a massive jump in the price of Chainlink’s LINK token over the past 30 days."
2024-02-07,Chainlink's LINK Has Another Stellar Week,"It’s been a standout week for Chainlink’s native token. LINK is the only member of the CoinDesk 20 to return positively week-on- week. When looking at market capitalization, LINK also now ranks eighth among the CoinDesk 20. CoinDesk's Jennifer Sanasie presents ""The Chart of the Day."""
2024-02-15,Telefónica Teams Up With Chainlink to Provide Security Against 'SIM Swap' Hacks,"The partnership will be a ""significant step"" in integrating telecom capabilities into the blockchain technology, the firms said."
2024-02-15,Can Ether Hit $3.5K on ETF Expectations? Cathie Wood's ARK Invest Sells Coinbase Shares,"""CoinDesk Daily"" host Jennifer Sanasie breaks down the biggest headlines impacting the crypto industry today, as the price of ether (ETH) rose through the $2,800 mark for the first time since May 2022. Plus, insights on the partnership between Telefónica and Chainlink to maintain security against Web3-related hacks and exploits. And, Cathie Wood's ARK Invest sold $34.3 million worth of Coinbase shares, the first time the firm has done so in a month."
2024-02-28,Ark and 21Shares to Disclose Spot Bitcoin ETF Reserves Via Chainlink Integration,The move comes after fellow spot bitcoin ETF issuer Bitwise drew applause from industry experts for making its wallet address public in January.
2024-04-11,Chainlink Aims to Make Transfers Across Blockchains Safer with New Bridge App 'Transporter',"""Having a secure way to move both value and data across chains is something the blockchain industry has needed for years,"" Chainlink co-founder Sergey Nazarov said."
2024-04-23,AI Safety for Smart Contracts Is AI Safety for the World,"Web3 infrastructure can bring new safety and reliability tools to AI, a cycle that will make the intersection of AI and Web3 massively and mutually beneficial, Chainlink scientist Ari Juels and Google AI lead Laurence Moroney write."
2024-05-16,"DTCC, Chainlink Complete Pilot to Accelerate Fund Tokenization with JPMorgan, Templeton, BNY Mellon Participating; LINK Gains 7%","The aim of the Smart NAV pilot was to test a process to bring and disseminate fund data on multiple blockchains, a key step for tokenization."
2024-05-17,"Bitcoin Rises Above $67K, but Lags Broader Crypto Market as ETH, SOL, LINK Post Big Gains",Softer U.S. inflation figures and big institutional interest in the spot bitcoin ETFs helped turn sentiment around.
2024-05-30,Aptos Integrates Chainlink's CCIP and Data Feeds to Boost Decentralized App Development,"Aptos will be the first blockchain that uses the Move coding language to integrate Chainlink's services, according to the announcement at Consensus 2024 in Austin."
2024-10-21,Chainlink Partners With Major Financial Players to Improve Corporate Actions Data Reporting Using AI and Blockchain,"Automating and standardizing corporate actions data could help significantly reduce operational inefficiencies that currently cost businesses millions of dollars every year due to errors and manual data processing, the report said."
2024-10-22,ANZ to Kickstart Chainlink Private Transactions Protocol in RWA Boost,The private transactions allow institutional users to define privacy conditions in a way that keeps onchain data private from all third parties and adversaries.
2024-10-24,"Chainlink Expands to Bitcoin, Helping Original Blockchain With Its Layer-2 Shift",Chainlink's service is an integral part of most major blockchains but has not featured on Bitcoin until now.
2025-04-25,"Price analysis 3/17: BTC, ETH, BNB, ADA, DOT, XRP, UNI, LTC, LINK, BCH",Select altcoins could move toward new highs if Bitcoin price continues to trade in a tightening range.
2025-04-25,"Impending pennant breakout sets Bitcoin price back on the path to $14,000 ","Increasing volume and a breakout above a key trendline have set Bitcoin price back on the path to $14,000."
2025-04-25,"Top 5 cryptocurrencies to watch this week: BTC, BNB, ADA, BCH, LINK","Bitcoin looks strong and the indicators point to a possible break above $14,000 while altcoins could underperform in the short-term."
2025-04-25,Can Bitcoin hit $17K next? Watch these 3 key BTC price levels,Bitcoin dominance is climbing as altcoins search for a new bottom in what may be the perfect set up for a BTC rally to new all-time highs.
2025-04-25,"Price analysis 11/4: BTC, ETH, XRP, BCH, LINK, BNB, LTC, DOT, ADA, BSV ","After reaching a new 2020 high, Bitcoin traders are fighting to flip $14,100 to support and Ethereum is attempting to do the same to the $400 level.  "
2025-04-25,"Price analysis 11/6: BTC, ETH, XRP, BCH, LINK, BNB, LTC, DOT, ADA, BSV ",Bitcoin price looks slightly overextended in the short-term and may take a break while altcoins play catch-up.
2025-04-25,Critics grumble as YieldWars uses AP election call as an oracle,"YieldWars used Associated Press data to settle their prediction market, but some question the validity of using their call as an oracle "
2025-04-25,"Top 5 cryptocurrencies to watch this week: BTC, ETH, LINK, LEO, XEM","Select altcoins are moving higher as Bitcoin prepares for a renewed push to $16,000 "
2025-04-25,"Price analysis 11/9: BTC, ETH, XRP, BCH, LINK, BNB, LTC, DOT, ADA, BSV ","Bitcoin price is recovering well from its 6% drop to $14,800, but top altcoins are slow to follow."
2025-04-25,"Price analysis 11/11: BTC, ETH, XRP, LINK, BCH, BNB, DOT, LTC, ADA, BSV","Bitcoin and several altcoins are showing signs of breaking above their overhead resistance levels, which suggests bulls remain in control."
2025-04-25,The Bitcoin price has only been higher than now for 12 days in its history ,"Bitcoin’s explosive gains are strongly reflected by the number of days it has closed above $16,320."
2025-04-25,"Price analysis 11/13: BTC, ETH, XRP, LINK, BCH, LTC, BNB, DOT, ADA, BSV ","A few altcoins are trying to start a new up-move even though Bitcoin is struggling to pull above $16,300."
2025-04-25,Etherisc to offer blockchain-based crop insurance to Kenyan farmers,The project aims to provide a blockchain-based parametric insurance platform that helps protect smallhold farmers from the effects of climate change.
2025-04-25,"Price analysis 10/30: BTC, ETH, XRP, BCH, LINK, BNB, DOT, LTC, BSV, ADA",Bitcoin’s consolidation near a key overhead resistance is a sign of strength but the technical structure of most altcoins has weakened.
2025-04-25,"Price analysis 11/16: BTC, ETH, XRP, LINK, BCH, LTC, BNB, DOT, ADA, BSV ","Bitcoin has resumed its journey toward a new all-time high, and the renewed bullish momentum is pulling altcoin prices higher."
2025-04-25,Matic becomes the first outside Ethereum to launch native Chainlink feeds,Five price feeds will be directly published on Matic mainnet.
2025-04-25,"Price analysis 11/20: BTC, ETH, XRP, LINK, LTC, BCH, DOT, BNB, ADA, BSV ","Bitcoin price is back on the path to a new all-time high, and it seems altcoins intend to follow suit."
2025-04-25,"Price analysis 11/23: BTC, ETH, XRP, LINK, LTC, BCH, DOT, ADA, BNB, BSV ","Bitcoin could consolidate for a few more days as the action shifts to Ether, XRP and other large-cap altcoins."
2025-04-25,"Price analysis 11/25: BTC, ETH, XRP, BCH, LINK, LTC, ADA, DOT, BNB, XLM",Bitcoin and most major altcoins could consolidate for a few days before starting the next big move.
2025-04-25,"Price analysis 11/27: BTC, ETH, XRP, BCH, LINK, LTC, ADA, DOT, XLM, BNB","Bitcoin’s recent correction is healthy, but several altcoins have lost momentum and could remain range-bound for a few days."
2025-04-25,"Price analysis 11/30: BTC, ETH, XRP, BCH, LINK, LTC, ADA, DOT, BNB, XLM","Bitcoin broke out to secure a new 2020 high at $19,863 and altcoins look ready to follow BTC higher. "
2025-04-25,"Price analysis 12/2: BTC, ETH, XRP, LTC, BCH, LINK, DOT, ADA, BNB, XLM","Bitcoin reclaimed the $19,000 level, but charts suggest BTC and altcoins may consolidate for a few days before starting the next trending move."
2025-04-25,"Price analysis 12/4: BTC, ETH, XRP, LTC, BCH, LINK, DOT, ADA, BNB, XLM","Many altcoins are seeing sharp corrections as Bitcoin price struggles to hold $19,000 as support. "
2025-04-25,"Price analysis 12/7: BTC, ETH, XRP, LTC, BCH, LINK, DOT, ADA, BNB, XLM","Bitcoin price continues to meet resistance at $19,500, a signal that further sideways action in BTC and altcoins is on the cards."
2025-04-25,"Price analysis 12/9: BTC, ETH, XRP, LTC, BCH, LINK, DOT, ADA, BNB, XLM","Bitcoin and several altcoins have recovered sharply from their intraday lows, a signal that there is healthy demand at lower levels."
2025-04-25,"Price analysis 12/11: BTC, ETH, XRP, LTC, BCH, LINK, ADA, DOT, BNB, XLM",The market-wide correction looks set to continue as Bitcoin and most major altcoins are facing selling at higher levels. 
2025-04-25,How Chainlink  may recover despite LINK price 'death cross' ,"LINK, the native token of Chainlink, is beginning to recover after seeing a major drop against Bitcoin."
2025-04-25,"Price analysis 11/18: BTC, ETH, XRP, LINK, LTC, BCH, DOT, BNB, ADA, BSV ",Bitcoin price looks ready to consolidate after reaching a new 2020 high and altcoins may attempt to recover from their sharp losses.
2025-04-25,"Price analysis 10/28: BTC, ETH, XRP, BCH, LINK, BNB, DOT, LTC, BSV, ADA     ","Altcoins took a serious hit as Bitcoin dropped below $13K today, meanwhile, BTC’s macrostructure remains bullish."
2025-04-25,‘Where are the LINK Marines?’ Chainlink beats Bitcoin with 610% YTD returns ,"Chainlink delivers easily the best year-to-date returns in 2020, but Bitcoin is still down the least against its all-time highs."
2025-04-25,"Price analysis 10/26: BTC, ETH, XRP, BCH, LINK, BNB, DOT, LTC, BSV, ADA     ","Bitcoin and altcoins are showing signs of short-term exhaustion, meaning a few days of consolidation could occur."
