date,headline,summary
2025-04-25,"Price analysis 2/2: BTC, ETH, BNB, SOL, XRP, ADA, AVAX, DOGE, DOT, LINK","Bitcoin’s historical performance in February favors bulls, opening the gates for a possible rally above $45,000. Will altcoins follow?"
2025-04-25,"Bitcoin’s muted price volatility shifts traders’ focus to LINK, ICP, RNDR and SUI","Bitcoin’s range bound price action has altcoin traders taking a closer look at LINK, ICP, RNDR and SUI."
2025-04-25,Chainlink's 40% weekly rally might be a 'bull trap' for LINK price,"There is a growing divergence between LINK's rising prices and declining momentum, hinting at an exhausting bullish sentiment in the market."
2025-04-25,"Price analysis 2/7: BTC, ETH, BNB, SOL, XRP, ADA, AVAX, DOGE, DOT, LINK ",Bitcoin’s price-bound price action could reach a breaking point if the sharp drop in U.S. regional bank stocks intensifies. How might altcoins react? 
2025-04-25,"Price analysis 2/9: BTC, ETH, BNB, SOL, XRP, ADA, AVAX, DOGE, DOT, LINK ",Rising inflows into the spot Bitcoin ETFs have improved investors' sentiment toward the crypto market and could a factor in BTC price and altcoins moving higher.
2025-04-25,Chainlink (LINK) hits 1-year price high above $20 — Here’s what to expect next,A surge in network activity and increased adoption throughout DeFi may have played a role in LINK rallying above $20.
2025-04-25,"Price analysis 2/14: BTC, ETH, SOL, BNB, XRP, ADA, AVAX, DOGE, LINK, DOT","Bitcoin price continues to march higher, fueled by robust demand from the spot Bitcoin ETFs. Which altcoins could follow BTC's bullish price action? "
2025-04-25,Telefónica taps Chainlink to combat SIM swap attacks,Telefónica said that the integration with Chainlink ensures that devices’ SIM cards will not undergo unauthorized changes.
2025-04-25,"Price analysis 2/16: BTC, ETH, SOL, BNB, XRP, ADA, AVAX, DOGE, LINK, DOT","Spot Bitcoin ETF demand remains robust, but Bitcoin could face stiff resistance near $52,000. How could altcoins react?"
2025-04-25,"Price analysis 2/21: BTC, ETH, BNB, SOL, XRP, ADA, AVAX, DOGE, LINK, DOT","Bulls failed to hold Bitcoin price above $52,000, possibly marking the start of a short-term trend change in BTC and altcoins. "
2025-04-25,"Price analysis 2/23: BTC, ETH, BNB, SOL, XRP, ADA, AVAX, DOGE, LINK, DOT ","Bitcoin is trading sideways with a negative bias, increasing the possibility of a short-term correction that could pull altcoins lower."
2025-04-25,The global financial system is the ‘net new buyers’ this cycle — Chainlink founder,"Chainlink founder Sergey Nazarov pointed out the significant new crypto buyer group while eyeing the next development in the crypto market, real-world asset tokenization."
2025-04-25,Chainlink CCIP revenue surges 180% over 2 months amid ‘massive adoption’,"The cumulative revenue for the cross-chain protocol which launched in July 2023 has reached $377,724. "
2025-04-25,Avalanche and Chainlink collaborate on Australasian on-chain asset settlement ,The Australia and New Zealand Banking Group alongside Chainlink Labs collaborated to connect Avalanche and Ethereum blockchain networks for on-chain settlement solutions.   
2025-04-25,History of Crypto: The ICO Boom and Ethereum's Evolution,"In 2017 the initial coin offering boom launched a tidal wave of activity for the crypto industry. Despite being plagued by scams and fraud, the ICO boom was also responsible for some of the most important crypto projects in the industry today. "
2025-04-25,Chainlink aims to bolster cross-chain security via Transporter ,"Chainlink aims to make cross-chain bridges, which account for nearly 50% of all value lost to DeFi exploits, more secure."
2025-04-25,Chainlink co-founder expects more coins to have ETFs — Token2049 ,Chainlink co-founder Sergey Nazarov believes the crypto space will “keep pushing the limits” of what’s possible.
2025-04-25,Chainlink debuts new protocol aimed at boosting cross-chain interoperability,The Cross-Chain Interoperability Protocol will make cross-chain smart contracts more interoperable across nine blockchain networks.
2025-04-25,Tokenization’s next phase requires real-world data integration — Chainlink ,Chainlink Labs’ director of capital markets said that enhancing tokens with real-world data could unlock better applications than traditional finance.
2025-04-25,Chainlink to join Rapid Addition in building blockchain adapter for institutions,Chainlink Labs’ Vince Turcotte told Cointelegraph that they expect digitally-native institutions to be the first to adopt the integration. 
2025-04-25,"DTCC, Chainlink complete fund data tokenization pilot with US banks","The pilot program tested a method of bringing traditional finance fund data onto blockchains, with big banks JPMorgan and BNY Mellon also involved."
2025-04-25,"Arta TechFin, Chainlink expand partnership to tokenize real-world assets","Arta TechFin, a Hong Kong-based asset manager, and Chainlink are exploring solutions to tokenize real-world assets like real estate."
2025-04-25,"Chainlink price hits 6-week high, is $20 LINK the next stop? ",LINK’s double-digit rally is backed by increasing network activity and a bullish technical setup.
2025-04-25,"Bitcoin might get boring — But Ether may propel LINK, UNI, ARB prices higher","After the initial subdued reaction to the spot Ether ETF approval, Ether may move up, pulling LINK, UNI, and ARB higher, while Bitcoin may consolidate."
2025-04-25,Chainlink co-founder notes importance of oracle networks following NYSE glitch,Sergey Nazarov explained how Chainlink could remedy centralized points of failure inherent in centralized information processing systems.
2025-04-25,Chainlink (LINK) rebounds toward multi-month high — What’s behind the move?,"Traders are turning bullish on Chainlink again, but what’s driving the price move?"
2025-04-25,"Chainlink, Microsoft, Banco Inter collaborate on Brazil’s CBDC pilot",The Drex phase two pilot leverages Chainlink’s CCIP and Microsoft’s cloud infrastructure to innovate trade finance automation.
2025-04-25,Chainlink ‘god candle’ appears as LINK price soars 27% in 24 hours,"LINK gained 27% in a single day after announcing the integration of an EU-based tokenized asset service, which resulted in a massive surge in user activity."
2025-04-25,"Price analysis 3/5: BTC, ETH, XRP, BNB, SOL, ADA, DOGE, PI, HBAR, LINK","Bitcoin struggles to overcome $90,000 as bears attempt to hold the level as resistance, but BTC and altcoin charts suggest the upside is the most likely path that prices will take."
2025-04-25,"Price analysis 3/7: BTC, ETH, XRP, BNB, SOL, ADA, DOGE, PI, HBAR, LINK","Bitcoin is trying to form a higher low at $85,000, but the recovery attempt faces stiff resistance at $90,000, signaling a tough battle between the bulls and the bears."
2025-04-25,"Price analysis 3/14: BTC, ETH, XRP, BNB, SOL, ADA, DOGE, PI, LEO, LINK","Bitcoin’s recovery near $85,000 shows solid buying at lower levels, signaling that the downside may be limited."
2025-04-25,Hyperliquid’s mystery 50x ETH whale is now betting on LINK,"The trader’s previous bet, nominally worth roughly $200 million, caused millions of dollars in losses for Hyperliquid’s liquidity providers."
2025-04-25,"Price analysis 3/19: BTC, ETH, XRP, BNB, SOL, ADA, DOGE, LINK, LEO, TON",Bitcoin shows strength as the market awaits today’s FOMC minutes and comments from Federal Reserve Chair Jerome Powell.
2025-04-25,Crypto sleuth ZachXBT says he unmasked 50x Hyperliquid whale,He claims the whale was previously arrested for stealing $1 million from two casinos in 2023.
2025-04-25,"Price analysis 3/24: SPX, DXY, BTC, ETH, XRP, BNB, SOL, DOGE, ADA, LINK",Bitcoin bulls press BTC price closer to a key resistance level as crypto markets rebound and investor sentiment improves.
2025-04-25,Abu Dhabi’s financial free zone signs MoU with Chainlink for tokenization frameworks,"Crypto adoption is increasing in the United Arab Emirates, with crypto app downloads rising 41% in 2024 from the previous year."
2025-04-25,"Price analysis 3/26: BTC, ETH, XRP, BNB, SOL, DOGE, ADA, LINK, AVAX, XLM","Bitcoin continues to face selling near $90,000, but the shallow pullback suggests that traders are viewing price dips as purchasing opportunities again."
2025-04-25,"Price analysis 3/28: BTC, ETH, XRP, BNB, SOL, DOGE, ADA, TON, LINK, AVAX",Bitcoin falls to its range lows as a fresh round of US tariffs spook markets and raise investors’ inflation fears.
2025-04-25,"Price analysis 4/2: BTC, ETH, XRP, BNB, SOL, DOGE, ADA, TON, LINK, LEO","Bitcoin bulls are trying to clear a critical overhead hurdle at $88,000. Will large-cap altcoins follow?"
2025-04-25,"PayPal, Venmo to roll out Solana, Chainlink transfers",The addition of SOL and LINK came in response to user feedback about expanding PayPal’s crypto token offerings.
2025-04-25,"Price analysis 4/4: BTC, ETH, XRP, BNB, SOL, DOGE, ADA, TON, LEO, LINK",Bitcoin and select altcoins hold steady even as the threat of a global trade war crushes the stock market.
2025-04-25,"Price analysis 4/9: BTC, ETH, XRP, BNB, SOL, DOGE, ADA, LEO, LINK, TON",Bitcoin price shows strength despite persistent weakness in global stock markets. Will altcoins follow?
2025-04-25,"Price analysis 4/11: BTC, ETH, XRP, BNB, SOL, DOGE, ADA, LEO, LINK, AVAX","Bitcoin remains strong and on target to break above a stiff overhead resistance zone, signaling a possible short-term bottom. Will altcoins follow?"
2025-04-25,"Price predictions 4/16: BTC, ETH, XRP, BNB, SOL, DOGE, ADA, LEO, LINK, AVAX","Bitcoin price continues to find buyers on each dip, increasing the likelihood of a rally to $95,000."
2025-04-25,"Price predictions 4/18: BTC, ETH, XRP, BNB, SOL, DOGE, ADA, LEO, LINK, AVAX","Bitcoin trades in a tightening range, signalling that range expansion is likely to occur in the near future."
2025-04-25,"Price analysis 4/21: SPX, DXY, BTC, ETH, XRP, BNB, SOL, DOGE, ADA, LINK","Bitcoin’s strong up move increases the likelihood of a rally to $95,000, signaling that the bottom may be in."
2025-04-25,Oregon AG lawsuit against Coinbase calls XRP unregistered security,"Oregon Attorney General Dan Rayfield sued Coinbase, alleging it offered XRP and 30 other crypto tokens as unregistered securities in violation of state law."
2025-04-25,"PayPal, Venmo to roll out Solana, Chainlink transfers",The addition of SOL and LINK came in response to user feedback about expanding PayPal’s crypto token offerings.
2025-04-25,"Price analysis 4/4: BTC, ETH, XRP, BNB, SOL, DOGE, ADA, TON, LEO, LINK",Bitcoin and select altcoins hold steady even as the threat of a global trade war crushes the stock market.
2025-04-25,"Price analysis 4/9: BTC, ETH, XRP, BNB, SOL, DOGE, ADA, LEO, LINK, TON",Bitcoin price shows strength despite persistent weakness in global stock markets. Will altcoins follow?
2025-04-25,"Price analysis 4/11: BTC, ETH, XRP, BNB, SOL, DOGE, ADA, LEO, LINK, AVAX","Bitcoin remains strong and on target to break above a stiff overhead resistance zone, signaling a possible short-term bottom. Will altcoins follow?"
2025-04-25,"Price predictions 4/16: BTC, ETH, XRP, BNB, SOL, DOGE, ADA, LEO, LINK, AVAX","Bitcoin price continues to find buyers on each dip, increasing the likelihood of a rally to $95,000."
2025-04-25,"Price predictions 4/18: BTC, ETH, XRP, BNB, SOL, DOGE, ADA, LEO, LINK, AVAX","Bitcoin trades in a tightening range, signalling that range expansion is likely to occur in the near future."
2025-04-25,"Price analysis 4/21: SPX, DXY, BTC, ETH, XRP, BNB, SOL, DOGE, ADA, LINK","Bitcoin’s strong up move increases the likelihood of a rally to $95,000, signaling that the bottom may be in."
2025-04-25,Oregon AG lawsuit against Coinbase calls XRP unregistered security,"Oregon Attorney General Dan Rayfield sued Coinbase, alleging it offered XRP and 30 other crypto tokens as unregistered securities in violation of state law."
2025-04-25,"Price analysis 2/28: BTC, ETH, XRP, BNB, SOL, DOGE, ADA, LTC, LINK, AVAX",Bitcoin’s sharp recovery is proof that dip buyers remain active at lower levels. Will altcoins follow?
2025-04-25,Chainlink token surges 29% as community dubs LINK the true ‘bank coin’,"Zach Rynes, also known as ChainkLinkGod, said XRP is a “banker-themed memecoin” that failed to get traction."
2025-04-25,"Price analysis 2/26: BTC, ETH, XRP, BNB, SOL, DOGE, ADA, LINK, SUI, AVAX","Bitcoin appears on the verge of losing the $85,000 level, which could trigger a cascading liquidation event. Will bulls show up to buy the dip and defend a critical support level?"
2025-04-25,"Celo, Chainlink, Hyperlane launch crosschain USDT on OP Superchain",Stablecoin interoperability is becoming a major driving force for developers seeking to ease the cost and settlement burden of transactions.
2025-04-25,Chainlink integrates with Coinbase tokenized assets platform,Chainlink will enable verifiable data transmission and crosschain interoperability for Coinbase’s Project Diamond.
2025-04-25,DeFi growth boosts oracle market competition — RedStone co-founder,"As DeFi expands, the oracle market faces new competition from emerging providers challenging established players like Chainlink."
2025-04-25,"Price analysis 12/13: BTC, ETH, XRP, SOL, BNB, DOGE, ADA, AVAX, LINK, SHIB","Bitcoin is facing selling above $100,000, but the repeated retest of a resistance level increases the likelihood of a breakout."
2025-04-25,"ETH, LINK, AAVE and BGB move higher as Bitcoin inches toward new all-time high","Bitcoin bulls are attempting to push BTC price above teh $104,088 all-time high, and charts suggest ETH, LINK, AAVE and BGB will be the first to breakout."
2025-04-25,"Price analysis 12/20: BTC, ETH, XRP, SOL, BNB, DOGE, ADA, AVAX, LINK, TON",A solid recovery in Bitcoin price is a hint that bulls have not given up on BTC and altcoins as they continue to buy dips below key support levels.
2025-04-25,Aave mulls Chainlink integration to return MEV fees to users,The DeFi protocol aims to capture around 40% of MEV profits from adding Chainlink's new oracle service.
2025-04-25,"Price analysis 12/25: BTC, ETH, XRP, SOL, BNB, DOGE, ADA, AVAX, LINK, TON","Bitcoin’s recovery shows solid buying at lower levels, increasing the possibility of a break above $100,000 in the short term."
2025-04-25,"Price analysis 12/27: BTC, ETH, XRP, BNB, SOL, DOGE, ADA, AVAX, LINK, TON","Bitcoin’s repeated failure to cross above $100,000 increases the risk of a drop under $90,000."
2025-04-25,10 crypto projects that delivered in 2024,"In an industry often dominated by hype, these 10 projects successfully delivered protocol improvements or new products in 2024."
2025-04-25,"Price analysis 1/1: BTC, ETH, XRP, BNB, SOL, DOGE, ADA, AVAX, LINK, TON","Bitcoin is holding above $90,000, signaling the possibility of a move back toward $100,000 in the next few days."
2025-04-25,"Price analysis 1/3: BTC, ETH, XRP, BNB, SOL, DOGE, ADA, AVAX, LINK, TON","Bitcoin price looks on track to reclaim the $100,000 level. Are altcoins set to follow?"
2025-04-25,Ripple partners with Chainlink to boost RLUSD stablecoin in DeFi markets,"Ripple’s RLUSD stablecoin gets a boost as Chainlink’s price feeds enable secure, real-time DeFi transactions on Ethereum and the XRP Ledger."
2025-04-25,"Price analysis 1/8: BTC, ETH, XRP, BNB, SOL, DOGE, ADA, AVAX, SUI, LINK","Bitcoin’s sell-off shows no signs of forming a bottom, which is destroying traders’ appetite for altcoins."
2025-04-25,"Price analysis 1/17: BTC, ETH, XRP, BNB, SOL, DOGE, ADA, AVAX, LINK, XLM","Bitcoin's chance of hitting a new all-time high has increased, buoyed by expectations of the adoption of a US Bitcoin reserve."
2025-04-25,"Price analysis 1/20: SPX, DXY, BTC, TRUMP, ETH, XRP, BNB, SOL, DOGE, ADA, LINK",Bitcoin retracts sharply from its all-time high and the sell-off in Official Trump has a resounding negative impact on most altcoins.
2025-04-25,"Price analysis 1/24: BTC, ETH, XRP, SOL, BNB, DOGE, ADA, LINK, AVAX, XLM","Bitcoin is holding firm above $100,000, indicating that every minor dip is being purchased in anticipation of new all-time highs."
2025-04-25,"SOL, LINK, OM, and RAY flash bullish signs as Bitcoin traders wait for BTC’s next move","Bitcoin trades in a predictable range while SOL, LINK, OM and RAY look ready to rally higher."
2025-04-25,"Price analysis 1/27: SPX, DXY, BTC, ETH, XRP, SOL, BNB, DOGE, ADA, LINK",Bitcoin and altcoins saw sharp selling as traders reduced risk following the popular launch of the DeepSeek AI app.
2025-04-25,"Price analysis 1/29: BTC, ETH, XRP, SOL, BNB, DOGE, ADA, LINK, AVAX, XLM","Bitcoin’s volatility is likely to pick up following Fed Chair Jerome Powell’s comments, but the potential direction of the price move remains elusive to most traders."
2025-04-25,"Price analysis 1/31: BTC, ETH, XRP, SOL, BNB, DOGE, ADA, LINK, AVAX, XLM",Bitcoin bulls are chasing after new highs but investor actions in equities markets and sellers at the top of BTC’s range are keeping a cap on price discovery.
2025-04-25,"Price analysis 2/3: SPX, DXY, BTC, ETH, XRP, SOL, BNB, DOGE, ADA, LINK","Bitcoin and select altcoins bounced back sharply, indicating solid purchasing demand at lower levels."
2025-04-25,"Price analysis 2/12: BTC, ETH, XRP, SOL, BNB, DOGE, ADA, LINK, AVAX, SUI","Bitcoin bears are finding it difficult to pin the price below $95,000, indicating solid demand at lower levels."
2025-04-25,Analysts predict delayed altcoin season amid lack of retail traders,"Some tokens saw price appreciation without increasing daily active wallets, indicating that altcoins are still in an early “speculative” phase of the cycle."
2025-04-25,"Price analysis 2/14: BTC, ETH, XRP, SOL, BNB, DOGE, ADA, LINK, AVAX, SUI","Bitcoin is trading in a tight range, pointing to a possible breakout in the near future."
2025-04-25,"Price analysis 2/17: SPX, DXY, BTC, ETH, XRP, BNB, SOL, DOGE, ADA, LINK","Bitcoin bulls appear reluctant to buy dips after BTC’s repeat failures to secure a close above $98,500."
2025-04-25,"Price analysis 2/19: BTC, ETH, XRP, SOL, BNB, DOGE, ADA, LINK, XLM, LTC","Bitcoin remains stuck inside the range, with no clear indication of a price breakout or breakdown."
2025-04-25,"Price analysis 2/21: BTC, ETH, XRP, BNB, SOL, DOGE, ADA, LINK, SUI, XLM","Bitcoin is showing signs of strength by rallying within a hair of $100,000. Which altcoins will follow?"
2025-04-25,"Price analysis 2/24: SPX, DXY, BTC, ETH, XRP, BNB, SOL, DOGE, ADA, LINK","Bitcoin price is at risk of falling from its current trading range and exploring new lows under $90,000. Can bulls turn the tide?"
2025-04-25,"Price analysis 3/22: BTC, ETH, BNB, ADA, DOT, XRP, UNI, LTC, LINK, THETA ",Bitcoin is stuck in a tight range but that has not stopped select altcoins from continuing their journey to new highs. 
2025-04-25,"Hacking group Pink Drainer strikes again, pilfering $4.4M from just 1 victim","The notorious crypto hacking group has been linked to several Discord and Twitter hacks this year, stealing over $18 million from more than 9,000 victims."
2025-04-25,"Price analysis 12/20: BTC, ETH, BNB, XRP, SOL, ADA, DOGE, AVAX, DOT, LINK ",Bitcoin price is back to chasing after its range high and most altcoins are following by hitting new year-to-date highs.
2025-04-25,"Price analysis 8/11: BTC, ETH, BNB, ADA, XRP, DOGE, DOT, UNI, LINK, SOL","Bitcoin and most major altcoins remain above their respective 200-day moving average, but the market's momentum will depend on whether BTC can pierce the $48,000 level."
2025-04-25,Chainlink launches data oracles on Arbitrum One's Ethereum scaling solution,"Chainlink’s data oracles are now live on Arbitrum One, with the team also planning to soon launch its Proof of Reserve and verifiable random function on the layer two."
2025-04-25,Time to pump? Data suggests traders intend to push Filecoin (FIL) above $100,Derivatives data and recent protocol developments signal that retail traders have turned bullish on FIL.
2025-04-25,Chainlink (LINK) looks for momentum while pro traders target $40,"LINK price is struggling to maintain its bullish momentum, but derivatives data shows a clear path to $40 in the long term. "
2025-04-25,"Price analysis 9/3: BTC, ETH, ADA, BNB, XRP, SOL, DOGE, DOT, UNI, LINK",This week’s sharp rally in Bitcoin and Ether signals that bulls are back in control and altcoins are likely to follow.
2025-04-25,LINK price locks in 36% gains following Ethereum layer 2's Chainlink integration,"The price of LINK also surged in the wake of a marketwide bullish boom, wherein Bitcoin and its top rivaling altcoins jumped in tandem."
2025-04-25,"Price analysis 9/6: BTC, ETH, ADA, BNB, XRP, SOL, DOGE, DOT, UNI, LINK","If bulls flip $52,000 to support, Bitcoin could see a substantial breakout that is likely to pull more buyers into select altcoins."
2025-04-25,Akon gives the play-to-earn poker platform a shoutout for being the next wave of gaming,"Leveraging blockchain technology and partnerships with Polygon and Chainlink, one online poker platform is positioning itself to reach new audiences with guaranteed fairness in a play-to-earn setting."
2025-04-25,"Top 5 cryptocurrencies to watch this week: BTC, DOT, UNI, LINK, XMR","Bitcoin could pick up momentum above $56,100 and that could attract buying in DOT, UNI, LINK, and XMR."
2025-04-25,MDT introduces blockchain oracle to accelerate DeFi adoption ,"The integration will allow for open-source development of niche, data-driven smart contracts."
2025-04-25,Associated Press plans to launch Chainlink node to publish data ,"The news agency added it would be open to shifting its approach based on the response from developers as it kept ""a finger on the pulse of the blockchain economy."""
2025-04-25,Chainlink’s total value secured surpasses $75B as DeFi continues to surge ,The oracle network’s exponential growth has been tied to the emergence of DeFi. Co-founder Sergey Nazarov said Chainlink is also powering metaverses. 
2025-04-25,Platform rides wave into a DeFi revolution with user rewards for playing and learning,"NFTs are more than purchasing million-dollar assets, they are about including everyone in the financial revolution."
2025-04-25,Platform leverages on-chain Forex markets supported by Chainlink to unlock the full potential of stablecoins,"With help from Forex markets, non-USD stablecoins may be the ticket to recognizing the full potential of DeFi."
2025-04-25,"Top 5 cryptocurrencies to watch this week: BTC, LTC, LINK, VET, AXS","From a bird’s-eye-view, BTC is still in an uptrend and a bounce off the $62,000 support could provide the signal for LTC, LINK, VET and AXS to move higher."
2025-04-25,Former Google CEO is now a strategic advisor for Chainlink Labs,"Having previously described Bitcoin as ""a remarkable cryptographic achievement"" and with an estimated net worth of roughly $23.6 billion, Schmidt will likely be one of the wealthiest individuals to act as a Chainlink advisor."
2025-04-25,Lending platform taps Chainlink Oracles to secure its DeFi lending and borrowing protocol,"With the help of Chainlink oracles, a trading and lending platform is set to transform DeFi trading and lending."
2025-04-25,Umbrella Network launches $15M oracle accelerator program ,"The blockchain oracle market is still largely dominated by Chainlink, but a handful of promising challengers is emerging.  "
2025-04-25,SBI Group launches crypto-asset fund for Japanese investors,"The SBI crypto-asset fund consists of seven cryptocurrencies including Bitcoin, Ethereum, Litecoin, XRP, Bitcoin Cash, Chainlink and Polkadot, none exceeding more than 20% in ratio."
2025-04-25,Oracle tokens turn bullish as blockchain projects focus on interoperability,"Oracle projects like LINK, BAND and TRB are seeing bullish momentum as crypto startups intensify their focus on interoperability in 2022. "
2025-04-25,"Top 5 cryptocurrencies to watch this week: BTC, LINK, ICP, LEO, ONE","LINK, ICP, LEO and ONE could rebound if traders sense that Bitcoin's selling is near completion."
2025-04-25,"Bitcoin price can’t find its footing, but BTC fundamentals inspire confidence in traders",Data shows traders still feel confident about BTC price because the futures premium and other fundamentals show no signs of stress. 
2025-04-25,"Top 5 cryptocurrencies to watch this week: BTC, LINK, HNT, FLOW, ONE","BTC is attempting to form a bottom while LINK, HNT, FLOW and ONE are showing early signs of accumulation."
2025-04-25,Climate-focused Hyphen aims to hold companies accountable for eco-data reporting,"“Corporations need the ability to accurately track and report their scope 1, 2 and 3 emissions to establish baselines ...,” says Austin. "
2025-04-25,Chainlink Verifiable Random Function v2 goes live on mainnet,Chainlink VRF v1 had previously crossed 3 million request transactions from NFT projects and blockchain games.
2025-04-25,GSR collaborates with Chainlink to integrate price data for smart contracts,"“High-quality market data is vital to the growth of the multi-chain ecosystem,” says Chainlink co-founder Sergey Nazarov."
2025-04-25,Chainlink launches startup program to provide blockchain resources to early-stage projects,Chainlink Labs aims to support startups to “help create a lasting Web3 ecosystem.”
2025-04-25,"Price analysis 8/9: BTC, ETH, BNB, ADA, XRP, DOGE, DOT, UNI, BCH, LINK","Bitcoin’s break above the 200-day SMA suggests that the downtrend could be over, and that may pull buyers back into altcoins."
2025-04-25,"Top 5 cryptocurrencies to watch this week: BTC, ADA, AXS, LINK, FTT","ADA, AXS, LINK and FTT may start a strong recovery in the next few days if BTC holds the $45,000 level as support.  "
