date,headline,summary
2025-04-25,"Price analysis 9/11: BTC, ETH, XRP, LINK, BCH, DOT, BNB, LTC, CRO, BSV","Although Bitcoin price is range-bound, a few altcoins have started a relief rally which could push them above key resistance levels."
2025-04-25,"Top 5 cryptocurrencies to watch this week: BTC, BNB, NEO, YFI, LINK",Bitcoin remains stuck in a tightening range but select altcoins may begin moving higher if they bounce off their key support levels.
2025-04-25,Crypto.com views Chainlink integration as a gateway to DeFi,"Crypto.com believes that having control over one's finances, data and identity is a basic human right."
2025-04-25,"Price analysis 9/14: BTC, ETH, XRP, BNB, DOT, LINK, BCH, CRO, LTC, BSV",Bitcoin and several altcoins are trying to break out of their respective overhead resistance levels in order to restore bullish momentum.
2025-04-25,"Price analysis 9/16: BTC, ETH, XRP, DOT, BCH, BNB, LINK, CRO, LTC, BSV","Bitcoin and a few altcoins have broken above key resistance levels, which suggests that the bulls are attempting to take control of the market."
2025-04-25,"Price analysis 9/18: BTC, ETH, XRP, DOT, BCH, BNB, LINK, CRO, LTC, BSV","Bitcoin and altcoins are facing selling near key resistance levels, but for now the possibility of a sharp fall remains low."
2025-04-25,"Top 5 cryptocurrencies to watch this week: BTC, NEO, XMR, ADA, LINK","As Bitcoin attempts to find a bottom, altcoins continue to decline, opening up opportunities on the long and short side."
2025-04-25,Orchid adds a new 'secret shopper' oracle for greater transparency,Picking Chainlink over its competitors was an easy decision for Waterhouse.
2025-04-25,"Price analysis 9/21: BTC, ETH, XRP, BCH, DOT, BNB, LINK, CRO, LTC, BSV",The market has taken a bearish turn and Bitcoin and altcoins will need strong relief rallies in order to restore their uptrends.
2025-04-25,"Price analysis 9/23: BTC, ETH, XRP, BCH, DOT, BNB, CRO, LTC, LINK, BSV",Bitcoin and altcoins are at risk of a deeper correction if they do not rise above their immediate resistance levels soon.
2025-04-25,Chainlink up 30% following six-week downtrend and developer sell-off ,A Chainlink developer address appears to have been offloading tokens and putting downward pressure on prices. But things are looking up. 
2025-04-25,Dave Portnoy meets Pomp: ‘Bitcoin is just one big Ponzi scheme’ ,Famous day trader Dave Portnoy says he misses crypto in a candid interview with Anthony Pompliano.
2025-04-25,"Price analysis 9/25: BTC, ETH, XRP, BCH, DOT, LINK, BNB, CRO, LTC, BSV ","Bitcoin and altcoins rebounded off their critical support levels, possibly creating a path to a new bullish uptrend."
2025-04-25,KuCoin hackers keep moving stolen tokens to the largest DeFi exchange ,Are the KuCoin hackers DeFi noobs?
2025-04-25,"Price analysis 9/28: BTC, ETH, XRP, BCH, BNB, DOT, LINK, ADA, BSV, CRO","Bitcoin and altcoins may hit a few roadblocks in the short-term as they near stiff overhead resistance levels, but the overall trajectory remains bullish."
2025-04-25,"Price analysis 9/30: BTC, ETH, XRP, BCH, BNB, DOT, LINK, BSV, CRO, ADA","Bitcoin and a few altcoins continue to push against resistance at higher levels, suggesting that the uptrend may resume soon."
2025-04-25,"Price analysis 10/2: BTC, ETH, XRP, BCH, BNB, DOT, LINK, CRO, BSV, LTC","The bulls are buying the dips in Bitcoin and a few altcoins, suggesting that investor sentiment remains positive."
2025-04-25,"Price analysis 10/5: BTC, ETH, XRP, BNB, BCH, DOT, LINK, CRO, LTC, ADA",Traders are attempting to kickstart a new trending move in Bitcoin and altcoins by attacking overhead resistance levels.
2025-04-25,"Price analysis 10/7: BTC, ETH, XRP, BCH, BNB, DOT, LINK, LTC, CRO, BSV",Bitcoin and altcoins could remain range-bound for a few days as traders search for triggers that will start the next trending move.
2025-04-25,"Price analysis 10/9: BTC, ETH, XRP, BCH, BNB, DOT, LINK, CRO, LTC, BSV","Bitcoin and select altcoins have broken out of their bullish setups, hinting that further upside could occur through the weekend."
2025-04-25,"Price analysis 10/12: BTC, ETH, XRP, BCH, BNB, LINK, DOT, ADA, LTC, CRO","Bitcoin’s strength above the $11,500 multi-year resistance is also pulling many altcoin prices higher."
2025-04-25,"Price analysis 10/14: BTC, ETH, XRP, BCH, BNB, LINK, DOT, ADA, LTC, BSV","Bitcoin and most major altcoins are sustaining above their immediate support levels, increasing the possibility that the uptrend will resume."
2025-04-25,"Price analysis 10/16: BTC, ETH, XRP, BCH, BNB, LINK, DOT, ADA, LTC, BSV    ",Bitcoin and altcoins must rebound off their immediate support levels to recapture bullish momentum and resume the uptrend.
2025-04-25,"Price analysis 10/19: BTC, ETH, XRP, BCH, BNB, LINK, DOT, ADA, LTC, BSV    ",Bitcoin price may rise to a new 52-week high if it can break above the ascending channel and this move could ignite the altcoins.
2025-04-25,"Price analysis 10/21: BTC, ETH, XRP, BCH, BNB, LINK, DOT, LTC, ADA, BSV    ",Bitcoin hit a new 2020 high and altcoins rallied as PayPal announced that it will support crypto payments.
2025-04-25,"Chainlink brings Verifiable Randomness to Ethereum mainnet, keeps other chains in sight",Sergey Nazarov: there is a demand for Chainlink VRF from other chains like Matic.
2025-04-25,"Price analysis 10/23: BTC, ETH, XRP, BCH, BNB, LINK, DOT, LTC, ADA, BSV    ","Bitcoin is showing signs of profit booking, resulting in a slight downturn in altcoin prices."
2025-04-25,"Price analysis 12/14: BTC, ETH, XRP, LTC, BCH, LINK, ADA, DOT, BNB, XLM","Bitcoin price regained the $19,000 level and continues to trade in a range, providing altcoins with the opportunity to steadily move higher."
2025-04-25,‘My heart is crypto’ — Dave Portnoy says he’s back into Bitcoin trading,"After a brief hiatus from crypto trading, Dave Portnoy says he’s coming back to Bitcoin, but are there other reasons for his return?"
2025-04-25,"Price analysis 12/16: BTC, ETH, XRP, LTC, BCH, LINK, ADA, DOT, BNB, XLM","Bitcoin’s break above $20,000 boosted investor sentiment and triggered strong rallies from several altcoins."
2025-04-25,"Price analysis 12/18: BTC, ETH, XRP, LTC, BCH, LINK, ADA, DOT, BNB, XLM",A handful of altcoins look ready to move higher as Bitcoin price enters a short consolidation phase.
2025-04-25,"Price analysis 1/29: BTC, ETH, DOT, XRP, ADA, LINK, LTC, BCH, BNB, XLM","Bitcoin’s surprise rally to $38,500 lifted sentiment across the market but the temporary boost appears to be losing steam."
2025-04-25,"Price analysis 2/1: BTC, ETH, XRP, DOT, ADA, LINK, LTC, BCH, BNB, XLM","Bitcoin price is trading in a tight range, which is allowing multiple altcoins to push higher."
2025-04-25,"Price analysis 2/3: BTC, ETH, XRP, DOT, ADA, LINK, LTC, BCH, BNB, XLM",Ethereum's rally to a new all-time high boosted investor sentiment in Bitcoin and several altcoins are now surging toward new highs.
2025-04-25,"Price analysis 2/5: BTC, ETH, XRP, DOT, ADA, LINK, LTC, BNB, BCH, XLM","Altcoins are reaching multi-year highs while Bitcoin price builds momentum for the next run at the $40,000 level."
2025-04-25,Growing list of billion-dollar crypto ‘unicorns’ suggest the best is yet to come ,"More than 53 blockchain projects have emerged as multi-billion dollar market cap crypto unicorns, a signal that the 2021 bull market is just getting started."
2025-04-25,"Top 5 cryptocurrencies to watch this week: BTC, DOT, LINK, XLM, THETA","Bitcoin is facing rejection above $40,000, but if the bulls do not give up much ground, several altcoins could resume their uptrend."
2025-04-25,"Price analysis 2/8: BTC, ETH, ADA, XRP, DOT, BNB, LTC, DOGE, LINK, BCH",Strong institutional demand has propelled Bitcoin and many altcoins to new all-time highs.
2025-04-25,"Chainlink hits new highs, but is LINK about to pull another 150% parabolic move? ",LINK is in price discovery mode but one chart suggests it’s about to explode by 154%. 
2025-04-25,"Price analysis 2/10: BTC, ETH, ADA, XRP, DOT, BNB, LTC, LINK, DOGE, BCH","Bitcoin and select altcoins are witnessing profit-booking at higher levels, a signal that a short phase of consolidation could occur over the next few days. "
2025-04-25,"Radix, Chainlink, Aave, Messari and others launch GoodFi crypto alliance ",GoodFi claims to be the first cryptocurrency alliance focused on furthering education and research into decentralized finance.  
2025-04-25,"Price analysis 2/12: BTC, ETH, ADA, XRP, DOT, BNB, LTC, LINK, XLM, BCH","Altcoins are soaring to new highs while Bitcoin price trades in a sideways range near the $47,000 support."
2025-04-25,Oracle-focused tokens rally as DeFi searches for trusted data providers,"The DeFi sector is booming but the future of the sector depends on oracles, here are some of the top contenders."
2025-04-25,"Price analysis 1/27: BTC, ETH, DOT, XRP, ADA, LINK, LTC, BCH, BNB, XLM","Bitcoin's dip below $30,000 triggered a sell-off in altcoins and dip-buying traders might not have enough momentum to cause a relief rally. "
2025-04-25,"Price analysis 2/15: BTC, ETH, ADA, XRP, DOT, BNB, LTC, BCH, LINK, XLM ",The sharp recovery in major altcoins and Bitcoin suggests the uptrend remains intact.
2025-04-25,"Price analysis 2/19: BTC, ETH, BNB, DOT, ADA, XRP, LTC, LINK, BCH, XLM",Bitcoin’s rally to a $1 trillion market cap could attract more buyers to the crypto sector and boost the price of several altcoins.
2025-04-25,"Chainlink rolls out OCR system upgrade, reducing gas costs tenfold","The Off-Chain Reporting upgrade changes how oracles aggregate data, easing the burden on the blockchains."
2025-04-25,"Price analysis 2/24: BTC, ETH, BNB, DOT, ADA, XRP, LTC, LINK, BCH, XLM","Bitcoin price is attempting to flip the $50,000 level back to support, while many altcoins are capitalizing on BTC's consolidation by moving higher."
2025-04-25,"Price analysis 2/26: BTC, ETH, ADA, BNB, DOT, XRP, LTC, LINK, BCH, XLM ",Bitcoin and most major altcoins remain rangebound with the exception of Cardano.
2025-04-25,"Price analysis 1/3: BTC, ETH, ADA, BNB, DOT, XRP, LTC, LINK, XLM, BCH ","Bitcoin and most major altcoins are witnessing strong buying at lower levels, indicating the start of a relief rally. "
2025-04-25,"Price analysis 3/3: BTC, ETH, ADA, BNB, DOT, XRP, LTC, LINK,  BCH, XLM","Now that Bitcoin price has flipped $50,000 back to support, small and large-cap altcoins are gearing up for a move higher. "
2025-04-25,A dark horse in the Ethereum scaling wars? Chainlink’s oracles find fertile ground on xDai,"Chainlink is rolling out support for xDai, a layer-two sidechain whose perceived centralization hasn’t stopped major DApp players."
2025-04-25,"Price analysis 3/5: BTC, ETH, ADA, BNB, DOT, XRP, UNI, LTC, LINK, BCH","Selling pressure from global equities markets continues to weigh on Bitcoin price as traders endeavor to flip the $50,000 level back to support.  "
2025-04-25,"Price analysis 3/8: BTC, ETH, BNB, ADA, DOT, XRP, UNI, LINK, LTC, BCH","Bitcoin and altcoins are picking up momentum as bulls attempt to secure a daily close above the $52,000 level."
2025-04-25,"Price analysis 3/10: BTC, ETH, BNB, ADA, DOT, XRP, UNI, LTC, LINK, BCH","Select altcoins could rally to new all-time highs if Bitcoin bulls successfully hold BTC above the $57,000 level. "
2025-04-25,"Price analysis 3/12: BTC, ETH, BNB, ADA, DOT, XRP, UNI, LTC, LINK, BCH","Bitcoin bulls are attempting to push BTC price back toward $58,000 but data shows altcoins may be losing their bullish momentum."
2025-04-25,"Price analysis 3/15: BTC, ETH, BNB, ADA, DOT, XRP, UNI, LTC, LINK, BCH",Bitcoin’s rejection at its all-time high and a negative divergence on the RSI suggest that BTC's bullish momentum could be weakening and altcoins may see profit-booking as a result.
2025-04-25,"Price analysis 2/17: BTC, ETH, DOT, ADA, XRP, BNB, LTC, BCH, LINK, XLM","Bitcoin price has posted a new all-time high today, and that may pull select altcoins higher. "
2025-04-25,Reddit investing group triggers crypto-style 860% rally in GameStop stock,The recent 860% rally in GameStop’s stock price shows social investing groups’ ability to trigger whipsaw asset volatility is not just limited to cryptocurrencies.
2025-04-25,"Price analysis 1/25: BTC, ETH, DOT, XRP, ADA, LINK, LTC, BCH, BNB, XLM","Altcoins continue to trend higher, but Bitcoin price needs to turn $35,000 to support in order for the entire market to gain momentum."
2025-04-25,Aave and Chainlink hit new highs as Bitcoin price fights to hold $32K,"Chainlink and Aave soared to a new all-time high as Bitcoin bulls struggle to hold BTC price above $32,000."
2025-04-25,"Price analysis 12/21: BTC, ETH, XRP, LTC, BCH, LINK, ADA, DOT, BNB, XLM","Even with today's correction, Bitcoin is still in an uptrend, but most major altcoins have lost momentum and may remain range-bound for the next few days."
2025-04-25,"Price analysis 12/23: BTC, ETH, XRP, LTC, BCH, LINK, BNB, ADA, DOT, XLM",The SEC’s lawsuit against Ripple may be bearish for a few altcoins but could be bullish for Bitcoin.
2025-04-25,"Price analysis 12/28: BTC, ETH, XRP, LTC, BCH, DOT, ADA, BNB, LINK, XLM",Bitcoin is taking a breather after the recent rally while altcoins are attempting to play catch up.
2025-04-25,"'Christmas magic,' says Chainlink user who received $11K in donations for $50K mistake",Aavegotchi sent the crypto user donations from more than 200 deposits for Christmas Day. 
2025-04-25,"Price analysis 12/30: BTC, ETH, XRP, LTC, BCH, DOT, ADA, BNB, LINK, BSV","Bitcoin price continues to chase after $30,000 but continued rejections below the key level are negatively impacting altcoin prices."
2025-04-25,"Bitcoin, stablecoins and DeFi: 2020’s top-performing crypto assets","2020 may have been filled with challenges, but Bitcoin, stablecoins and DeFi protocols are the clear top performing crypto assets for the year."
2025-04-25,"Price analysis 1/1: BTC, ETH, XRP, LTC, DOT, BCH, ADA, BNB, LINK, BSV","Altcoins could also see a strong buying interest and may run up vertically if Bitcoin rallies above $30,000."
2025-04-25,"Price analysis 1/4: BTC, ETH, XRP, LTC, DOT, BCH, ADA, BNB, LINK, BSV","After today’s sharp downside move, Bitcoin and altcoins could trade in a sideways range as bulls and bears fight to control the market’s momentum."
2025-04-25,The crypto and blockchain projects with the biggest buzz in 2020,"As the crypto community grows, several companies stood out to lead the pack in 2020."
2025-04-25,The 2020 altcoin Hype-to-Activity index,Tracking the hype and price action of several of your favorite cryptocurrencies.
2025-04-25,"Price analysis 1/6: BTC, ETH, XRP, LTC, ADA, DOT, BCH, XLM, LINK, BNB","Bitcoin's slow crawl toward $36,000 has given select altcoins the green light to rally higher."
2025-04-25,Warp Finance adds Chainlink oracles to protect against flash loans,"Warp Finance's hack of $8 million could have been prevented with better oracles, the team says."
2025-04-25,"Price analysis 1/8: BTC, ETH, XRP, LTC, ADA, DOT, BCH, XLM, LINK, BNB","Traders are buying every dip and pushing Bitcoin price to new highs on a daily basis, triggering many altcoins to follow suit."
2025-04-25,"Price analysis 1/11: BTC, ETH, XRP, LTC, BCH, ADA, DOT, LINK, BNB, XLM","Bitcoin’s sharp correction may not have broken its uptrend, but several altcoins have signaled that a short-term top could be in place."
2025-04-25,"Price analysis 1/13: BTC, ETH, XRP, LTC, ADA, BCH, DOT, XLM, LINK, BNB ",Traders are shifting funds into select altcoins as Bitcoin price trades in a sideways range. 
2025-04-25,"Price analysis 1/15: BTC, ETH, XRP, DOT, ADA, LTC, BCH, LINK, XLM, BNB","Altcoins have entered a slight correction after Bitcoin's relief rally lost steam and the price dropped below $35,000."
2025-04-25,Bitcoin bulls buy BTC’s $35K support retest as altcoins push higher,"Bitcoin’s lower support retest was bought up by bulls, preparing BTC for another push to $40,000."
2025-04-25,"Top 5 cryptocurrencies to watch this week: BTC, LINK, UNI, XTZ, ATOM",Bitcoin's brief period of consolidation has opened a path for select altcoins to rally higher.
2025-04-25,Chainlink surpasses Bitcoin Cash making LINK the 8th largest cryptocurrency ,"The market capitalization of Chainlink has surpassed Bitcoin Cash, as the DeFi market continues to prosper with TVL exceeding $24 billion."
2025-04-25,"1/18: BTC, ETH, DOT, XRP, ADA, LTC, BCH, LINK, XLM, BNB","Altcoins are beginning to lose bullish momentum as Bitcoin price struggles to reclaim $40,000."
2025-04-25,More than 80% of LINK is controlled by 125 wallets,New research from Glassnode indicates the top 1% of Chainlink holders control nearly 81% of the token’s supply.
2025-04-25,New ‘market fear’ index lets traders bet on crypto volatility,COTI’s new Crypto Volatility Index allows traders to profit from highly-volatile cryptocurrency markets.
2025-04-25,"Price analysis 1/20: BTC, ETH, DOT, XRP, ADA, LTC, BCH, LINK, XLM, BNB","Bitcoin price continues to drop, pushing select altcoins closer to their critical support levels. "
2025-04-25,3 ways the next altcoin bull cycle will vastly differ from 2017’s,"Bitcoin is still the main focus of most investors but Layer 2 solutions, governance, and DeFi are shaping up to be the driving forces of the next altseason."
2025-04-25,Is Grayscale about to unveil a LINK trust? ,Mystery filings using Grayscale’s name suggest the multibillion-dollar firm may be looking to expand the number of trusts.
2025-04-25,"Price analysis 1/22: BTC, ETH, DOT, XRP, ADA, LTC, LINK, BCH, BNB, XLM",Bitcoin price has rebounded above a key trendline but resistance at higher levels may limit the recovery in altcoins.
2025-04-25,Chainlink now bigger than Litecoin as LINK price hits new high above $24 — What's next? ,Chainlink has entered price discovery and traders should watch several key levels for the next possible top. 
2025-04-25,"'Be my Santa, please' — Chainlink user offers $13K reward to fix $50K mistake ","""I have already done hundreds of transactions on the ETH chain and by one oversight, rush, and my son's lessons, I lost my life savings."""
2025-04-25,"Price analysis 9/9: BTC, ETH, XRP, LINK, BCH, DOT, BNB, BSV, LTC, CRO",If the bulls can find momentum from the current bounce in Bitcoin and altcoins a short-term bottom may be in place.
2025-04-25,"Price Analysis Mar 2: BTC, ETH, XRP, BCH, BSV, LTC, EOS, BNB, XTZ, LINK",The bulls have succeeded in defending the 200-day SMA in most major cryptocurrencies. This is likely to result in a sharp relief rally in the next few days.
2025-04-25,"Top 5 Cryptocurrencies to Watch This Week: BTC, ETH, LINK, NEO, XEM",A short-term bottom for Bitcoin and altcoins may be confirmed if the bulls do not allow the recent lows to be broken during the next fall.
2025-04-25,"Price Analysis Mar 12: BTC, ETH, XRP, BCH, BSV, LTC, EOS, BNB, XTZ, LINK",The crypto markets are currently facing a strong wave of selling leading traders to focus on whether cryptocurrencies will form panic bottoms soon.
2025-04-25,Celsius Partners With Chainlink to Decentralize Price Data,The Celsius Network has begun using Chainlink’s price data feed oracles while offering treasury management services to the oracle platform.
2025-04-25,Chainlink (LINK) Rallies 149% Since March Bitcoin Price Crash,Chainlink leads the crypto market with a 149% rally since Bitcoin price crashed on March 13.
2025-04-25,"Price Analysis April 10: BTC, ETH, XRP, BCH, BSV, LTC, EOS, BNB, XTZ, LINK","Most major cryptocurrencies have turned down from their 50-day moving averages, suggesting that bears are attempting to resume the downtrend."
2025-04-25,"Gemini Adds Support for Dai, Chainlink and Orchid Trading This Month","Gemini is adding trading pairs with Dai, Chainlink and Orchid, bringing the total number of supported trading tokens to nine."
2025-04-25,"Price Analysis April 13: BTC, ETH, XRP, BCH, BSV, LTC, EOS, BNB, XTZ, LINK","Most major cryptocurrencies are attempting to bounce off their immediate support levels, which is a huge positive as it suggests buying on dips."
2025-04-25,XRP's Dismal 2020 Continues as Token Overtaken by LINK,"According to crypto analytics firm Messari, XRP was the worst performing large cap token in 2019 — and this year isn’t shaping up any better."
2025-04-25,"Price Analysis April 15: BTC, ETH, XRP, BCH, BSV, LTC, EOS, BNB, XTZ, LINK","The trading range of most major cryptocurrencies has tightened, meaning a sharp directional move could occur within the next few days."
2025-04-25,"Price Analysis April 17: BTC, ETH, XRP, BCH, BSV, LTC, EOS, BNB, XTZ, LINK",Most major cryptocurrencies appear ready to start new uptrends after recently bouncing off strong support levels.
2025-04-25,"Top 5 Cryptocurrencies to Watch This Week: ETH, XTZ, LINK, BNB, DASH",Investor sentiment in the crypto market is gradually turning bullish and a few altcoins look ready to outperform Bitcoin in the short-term.
2025-04-25,"Price Analysis 4/20: BTC, ETH, XRP, BCH, BSV, LTC, EOS, BNB, XTZ, LINK",Many major cryptocurrencies are not seeing follow up buying even after breaking out of resistance. This points to consolidation or a minor dip in the next few days.
2025-04-25,"Price Analysis 4/22: BTC, ETH, XRP, BCH, BSV, LTC, EOS, BNB, XTZ, LINK",The bounce in most major cryptocurrencies shows demand at lower levels and also increases the possibility of an up move in the next few days.
2025-04-25,Coinbase Emerges as a Major DeFi Contender With Price Oracle Launch,Coinbase gets into the DeFi space by launching a crypto price oracle.
2025-04-25,"Price Analysis 4/24: BTC, ETH, XRP, BCH, BSV, LTC, EOS, BNB, XTZ, LINK","Bitcoin is close to breaking out of its overhead resistance. This has resulted in strong price action in some altcoins, which suggests that the investor sentiment is bullish."
2025-04-25,Bancor’s Upcoming V2 Upgrade to Solve ‘DeFi’s Dirty Little Secret’,Bancor claims liquidity providers would risk losing value in their stake due to an issue called impermanent loss.
2025-04-25,VC Believes Link Could Soar Above $25 And Overtake Ether,A VC believes that Link could soar 700% to overtake Ether as DeFi insurance policy.
2025-04-25,Chainlink Crypto Price Oracles Enter Tezos Ecosystem,"SmartPy and Cryptonomic are adding Chainlink price oracles to the Tezos network, filling a perceived gap in the ecosystem."
2025-04-25,"Trader: Bitcoin's Current Rally Isn't Corrective, It's Impulsive",Crypto traders explain why this Bitcoin rally may be more than just a correction.
2025-04-25,"Chainlink (LINK), Tezos (XTZ) — Key Levels to Watch as BTC Consolidates",Tezos and Chainlink are the top-performing cryptocurrencies as Bitcoin is consolidating with a week left before the halving.
2025-04-25,Crypto Price Oracles Are About to Become “Unstoppable”,"A Chainlink node operator has moved its data to a new ""unstoppable"" domain on the Ethereum blockchain."
2025-04-25,Chainlink Brings Verifiable Randomness to Ethereum,Chainlink introduces trusted decentralized randomness into the crypto ecosystem.
2025-04-25,"Top 5 Cryptocurrencies to Watch This Week: BTC, XTZ, ADA, LINK, ETC","If Bitcoin remains in an uptrend, these altcoins are likely to outperform the other major cryptocurrencies this week."
2025-04-25,Centralized Crypto Futures Exchange Integrates Chainlink's Price Oracles,"Chainlink’s decentralized price oracles will be used as an ""anchor"" by the forthcoming derivatives exchange Digitex Futures to protect traders against slippage."
2025-04-25,"Top 5 Cryptocurrencies to Watch This Week: BTC, ETH, LINK, ADA, ETC","If Bitcoin can break above the overhead resistance, a few altcoins are likely to pick up momentum and provide short-term trading opportunities."
2025-04-25,Analyst Predicts Next Bull Run Will Send Bitcoin to $150K and Ether to $9K,"Blockfyre’s co-founder believes a bull market will return, seeing Bitcoin’s price rise 1,400% to hit $150,000 and Ether and other solid altcoins making even more impressive gains."
2025-04-25,ChainLink Price Oracles Dominate DeFi Data-Feeds Amid KyberSwap Integration,"Chainlink’s price oracles are quickly emerging as the industry-standard data source for the DeFi sector, with top project Kyber Network integrating the price feeds for its token swaps."
2025-04-25,China's Blockchain Service Network Integrates Chainlink Oracles,"China’s Blockchain Service Network, made up of some of the leading technology companies, is integrating Chainlink’s data oracles."
2025-04-25,Chainlink Taps New Partnership to Tackle Oracle Problem,Chainlink and Hdac Technology are developing a new system to bolster smart contract execution using off-chain data.
2025-04-25,Chainlink (LINK) Near New All-Time High — Here’s 3 Reasons for the Rally,"Today’s Chainlink rally leaves the price just 3% away from setting a new all-time high, but can bulls maintain the current momentum?"
2025-04-25,"Price Analysis Mar 9: BTC, ETH, XRP, BCH, BSV, LTC, EOS, BNB, XTZ, LINK",The crypto markets have turned down sharply over the weekend and are threatening to wipe out all the gains made in 2020.
2025-04-25,"Price Analysis Mar 6: BTC, ETH, XRP, BCH, BSV, LTC, EOS, BNB, XTZ, LINK","Several cryptocurrencies have broken out of their first resistance levels, which suggests that the bulls might be back in the game."
2025-04-25,New Study: US Dominates Crypto Twitter While Venezuela ‘Most Negative’,"Accounting for almost 40% of bitcoin tweets worldwide, the United States looms large over crypto twitter."
2025-04-25,"Top 5 Crypto Performers: BTC, LINK, XMR, BNB, XLM",Most cryptocurrencies are plunging. Is it a good time to buy or will the correction deepen? Let’s look at the charts.
