date,headline,summary
2025-04-25,"Bitcoin bull market pulls Kusama (KSM), Decred (DCR) and Qtum price higher","Improving fundamentals and fresh product rollouts are attracting new investors to Kusama, Decred and Qtum."
2025-04-25,"Eth2 becomes the fourth-largest staking network, and it keeps growing",Eth2 already ranks as the fourth-largest staking network by TVL despite launching six weeks ago and with withdrawals still yet to be enabled.
2025-04-25,"Top 5 cryptocurrencies to watch this week: BTC, BNB, DOT, XEM, MIOTA","Bitcoin’s correction is accelerating, but a bounce off the 50-day moving average could give altcoins reason to rebound off lower support levels then move higher."
2025-04-25,"Price analysis 2/26: BTC, ETH, ADA, BNB, DOT, XRP, LTC, LINK, BCH, XLM ",Bitcoin and most major altcoins remain rangebound with the exception of Cardano.
2025-04-25,Bison Trails' new Polkadot API promises faster access to data ,"The Polkadot Indexer is said to provide a more efficient way to get data from the Polkadot blockchain and its experimental platform, Kusama. "
2025-04-25,Polkadot could introduce ‘common good’ parachains with DOT-based smart contracts,Polkadot is likely to offload many of its core features to special-purpose public parachains.
2025-04-25,"Price analysis 2/24: BTC, ETH, BNB, DOT, ADA, XRP, LTC, LINK, BCH, XLM","Bitcoin price is attempting to flip the $50,000 level back to support, while many altcoins are capitalizing on BTC's consolidation by moving higher."
2025-04-25,"Price analysis 2/22: BTC, ETH, BNB, DOT, ADA, XRP, LTC, LINK, BCH, XLM ","Bitcoin and altcoins both saw a strong bounce off their intraday lows, which signals that traders still view dips as buying opportunities."
2025-04-25,The staking race: Late entrant Ethereum lags behind rivals with Eth2,"The second-biggest cryptocurrency is only the fourth-ranked staking network, but it’s looking to catch up to the rest."
2025-04-25,Polkadot (DOT) gains 42% ahead of its long-awaited parachain auctions,Polkadot price pushes to new highs over growing excitement for the upcoming parachain auctions and increased interoperability they will support.
2025-04-25,"Price analysis 2/19: BTC, ETH, BNB, DOT, ADA, XRP, LTC, LINK, BCH, XLM",Bitcoin’s rally to a $1 trillion market cap could attract more buyers to the crypto sector and boost the price of several altcoins.
2025-04-25,"The Graph adds support for Polkadot, NEAR, Solana and Celo",The global network of open APIs is expanding to support new layer 1 blockchains.
2025-04-25,"Price analysis 2/17: BTC, ETH, DOT, ADA, XRP, BNB, LTC, BCH, LINK, XLM","Bitcoin price has posted a new all-time high today, and that may pull select altcoins higher. "
2025-04-25,Polkadot indicator? Data shows Bitcoin has been following DOT price for months,Data shows DOT's price action has been a bellwether for Bitcoin over the past few months.
2025-04-25,Kusama (KSM) price jumps 70% ahead of the upcoming parachain auctions,KSM price establishes a new all-time high as competition heats up for the upcoming parachain auctions. 
2025-04-25,Polkadot’s roadmap for full launch fuels rally to all-time highs,"There is now a clear path to finally using Polkadot, but issues with the testnet suggest there may be delays."
2025-04-25,"Price analysis 2/15: BTC, ETH, ADA, XRP, DOT, BNB, LTC, BCH, LINK, XLM ",The sharp recovery in major altcoins and Bitcoin suggests the uptrend remains intact.
2025-04-25,Cardano approaches a new major upgrade as ADA posts an inspired rally,"Cardano’s Mary upgrade and token gains are poised to compete with Ethereum, while metrics suggest that Ethereum is still king."
2025-04-25,"Price analysis 2/12: BTC, ETH, ADA, XRP, DOT, BNB, LTC, LINK, XLM, BCH","Altcoins are soaring to new highs while Bitcoin price trades in a sideways range near the $47,000 support."
2025-04-25,Perceived centralization could kill PoS networks: ShapeShift report,ShapeShift believes the public perception of a network’s centralization could make or break the current generation of smart contract platforms.
2025-04-25,"Price analysis 2/10: BTC, ETH, ADA, XRP, DOT, BNB, LTC, LINK, DOGE, BCH","Bitcoin and select altcoins are witnessing profit-booking at higher levels, a signal that a short phase of consolidation could occur over the next few days. "
2025-04-25,"Price analysis 1/3: BTC, ETH, ADA, BNB, DOT, XRP, LTC, LINK, XLM, BCH ","Bitcoin and most major altcoins are witnessing strong buying at lower levels, indicating the start of a relief rally. "
2025-04-25,Curve Finance coming to Equilibrium's Polkadot parachain,Decentralized finance exchange platform Curve Finance will soon be implemented on Equilibrium’s Polkadot parachain.
2025-04-25,Identity-focused blockchain project moves to BSC with reduced token supply,A decentralized ecosystem that secures everything from identities to transactions has announced that the total supply of its native token is decreasing following a community vote.
2025-04-25,UC Berkeley partners with Parity Technologies to bolster blockchain curriculum ,"UC Berkeley, once known for its activism and progressive atmosphere, is now also major player in blockchain education. "
2025-04-25,Is this the future of how companies and organizations will be run?,"A DAO governance platform allows companies, foundations and hedge funds to be established in a decentralized, open and fair way."
2025-04-25,Polkadot moves towards sharding as Acala Network secures first Rococo parachain slot,Polkadot’s vision for a sharded parachain ecosystem is moving toward becoming a reality.
2025-04-25,"Price analysis 3/26: BTC, ETH, BNB, ADA, DOT, XRP, UNI, THETA, LTC, LINK","Bitcoin price bounced off the 50-day moving average but the real test is near $57,500 where the bears are likely to push back."
2025-04-25,"Price analysis 3/24: BTC, ETH, BNB, ADA, DOT, XRP, UNI, THETA, LTC, LINK","Bitcoin price is still meeting strong sell pressure near a key trendline, indicating the possibility of further downside for BTC and altcoins in the coming days. "
2025-04-25,"Price analysis 3/22: BTC, ETH, BNB, ADA, DOT, XRP, UNI, LTC, LINK, THETA ",Bitcoin is stuck in a tight range but that has not stopped select altcoins from continuing their journey to new highs. 
2025-04-25,"Price analysis 3/19: BTC, ETH, BNB, ADA, DOT, XRP, UNI, LTC, LINK, BCH","Several altcoins are moving to new all-time highs as bulls struggle to lift Bitcoin price above $60,000."
2025-04-25,Polkadot becomes latest to use Simplex's fiat on-ramp ,The integration with Simplex will provide DOT users another route from fiat into crypto.
2025-04-25,Cardano’s $1B futures open interest shows ADA is a serious contender,"Cardano's Coinbase listing helped push the open interest on its futures contracts above $1 billion, a signal that investors are seriously interested in ADA."
2025-04-25,"Price analysis 3/17: BTC, ETH, BNB, ADA, DOT, XRP, UNI, LTC, LINK, BCH",Select altcoins could move toward new highs if Bitcoin price continues to trade in a tightening range.
2025-04-25,"Polkadot integration sparks rallies in REN, OCEAN and CELR price",Projects facilitating cross-chain integration with the Polkadot ecosystem have rallied to new highs while the Ethereum network continues to struggle with high fees. 
2025-04-25,"Price analysis 3/15: BTC, ETH, BNB, ADA, DOT, XRP, UNI, LTC, LINK, BCH",Bitcoin’s rejection at its all-time high and a negative divergence on the RSI suggest that BTC's bullish momentum could be weakening and altcoins may see profit-booking as a result.
2025-04-25,"Price analysis 3/12: BTC, ETH, BNB, ADA, DOT, XRP, UNI, LTC, LINK, BCH","Bitcoin bulls are attempting to push BTC price back toward $58,000 but data shows altcoins may be losing their bullish momentum."
2025-04-25,Alameda Research invests $20M in Reef Finance ,The investment will reportedly allow Reef to implement more cross-chain integrations with Serum and Raydium on Solana.
2025-04-25,"Price analysis 3/10: BTC, ETH, BNB, ADA, DOT, XRP, UNI, LTC, LINK, BCH","Select altcoins could rally to new all-time highs if Bitcoin bulls successfully hold BTC above the $57,000 level. "
2025-04-25,Parity Technologies to propose first common-good parachain for Polkadot,The development arm behind Polkadot plans to develop and propose its first common-good parachain.
2025-04-25,"Price analysis 3/8: BTC, ETH, BNB, ADA, DOT, XRP, UNI, LINK, LTC, BCH","Bitcoin and altcoins are picking up momentum as bulls attempt to secure a daily close above the $52,000 level."
2025-04-25,99% gone in 60 seconds: How a Polkadot trader may have crashed DOT futures,"Polkadot (DOT) futures at Binance flash-crashed by 99.5%, potentially generating an $8.3-million profit for the ‘trader’ if they used this clever strategy."
2025-04-25,"Price analysis 3/5: BTC, ETH, ADA, BNB, DOT, XRP, UNI, LTC, LINK, BCH","Selling pressure from global equities markets continues to weigh on Bitcoin price as traders endeavor to flip the $50,000 level back to support.  "
2025-04-25,Polkadot futures market flippens Litecoin as its open interest hits $573M,Polkadot raced past Litecoin to become the fourth largest futures market as its open interest reached $573 million this week. 
2025-04-25,"Price analysis 3/3: BTC, ETH, ADA, BNB, DOT, XRP, LTC, LINK,  BCH, XLM","Now that Bitcoin price has flipped $50,000 back to support, small and large-cap altcoins are gearing up for a move higher. "
2025-04-25,"XRP risks losing top-5 crypto status as Polkadot, Cardano market caps hit $21B",A second usurping of XRP by Polkadot leaves it perilously close to exiting the top five cryptocurrencies by market cap.
2025-04-25,Binance Labs backs Polkadot ecosystem with $2.4m investment in Plasm Network,Binance has mobilized nearly one-quarter of its Polkadot ecosystem fund to lead Plasm Network’s Series A funding round. 
2025-04-25, Bitcoin volatility almost returned to 'Black Thursday' levels in January,A report from Kraken has identified last month’s BTC volatility at levels not seen since the ‘Black Thursday’ crash of early 2020.
2025-04-25,DOT flip: Polkadot overtakes XRP to become the fourth largest cryptocurrency,DOT is on fire today as it surges up the market cap charts to fourth spot. 
2025-04-25,"Zcash (ZEC), Kusama (KSM) and Hedget (HGET) soar as Bitcoin hits $40K ","Zcash, Kusama and Hedget are a few of the projects seeing their token values increase due to the unique set of issues they address."
2025-04-25,Polkadot skyrockets nearly 30% to $10 billion market cap: What’s behind the rally?,"The price of DOT, the native cryptocurrency of Polkadot, surged 24% on the day to achieve a $10 billion valuation."
2025-04-25,"Bitcoin price rally to $37,850 signals that bulls intend to reclaim $40K","Bitcoin’s break above the $35,000 resistance shows bulls are serious about retaking $40,000 in the short-term. "
2025-04-25,"Price analysis 1/13: BTC, ETH, XRP, LTC, ADA, BCH, DOT, XLM, LINK, BNB ",Traders are shifting funds into select altcoins as Bitcoin price trades in a sideways range. 
2025-04-25,"Price analysis 1/11: BTC, ETH, XRP, LTC, BCH, ADA, DOT, LINK, BNB, XLM","Bitcoin’s sharp correction may not have broken its uptrend, but several altcoins have signaled that a short-term top could be in place."
2025-04-25,"Price analysis 1/8: BTC, ETH, XRP, LTC, ADA, DOT, BCH, XLM, LINK, BNB","Traders are buying every dip and pushing Bitcoin price to new highs on a daily basis, triggering many altcoins to follow suit."
2025-04-25,"Price analysis 1/6: BTC, ETH, XRP, LTC, ADA, DOT, BCH, XLM, LINK, BNB","Bitcoin's slow crawl toward $36,000 has given select altcoins the green light to rally higher."
2025-04-25,"Price analysis 1/4: BTC, ETH, XRP, LTC, DOT, BCH, ADA, BNB, LINK, BSV","After today’s sharp downside move, Bitcoin and altcoins could trade in a sideways range as bulls and bears fight to control the market’s momentum."
2025-04-25,"Top 5 cryptocurrencies to watch this week: BTC, ETH, DOT, BNB, UNI","Bitcoin may be in the last leg of its parabolic run and if the rally sustains, select altcoins may surprise to the upside."
2025-04-25,"Price analysis 1/1: BTC, ETH, XRP, LTC, DOT, BCH, ADA, BNB, LINK, BSV","Altcoins could also see a strong buying interest and may run up vertically if Bitcoin rallies above $30,000."
2025-04-25,"Polkadot's founder looks back on the year, teases Substrate 3.0 in early 2021","Polkadot has recounted its gains in 2020, identifying its dominance of the crypto staking scene among other notable milestones for the year."
2025-04-25,"Bitcoin, stablecoins and DeFi: 2020’s top-performing crypto assets","2020 may have been filled with challenges, but Bitcoin, stablecoins and DeFi protocols are the clear top performing crypto assets for the year."
2025-04-25,"Price analysis 12/30: BTC, ETH, XRP, LTC, BCH, DOT, ADA, BNB, LINK, BSV","Bitcoin price continues to chase after $30,000 but continued rejections below the key level are negatively impacting altcoin prices."
2025-04-25,Bitcoin price rally cools down as Polkadot gains 34% in first week of ‘altseason’,"Bitcoin dominance is likely topping out, Michaël van de Poppe argues, as Bitcoin gives way to strong moves from some top 10 altcoins."
2025-04-25,"Price analysis 12/28: BTC, ETH, XRP, LTC, BCH, DOT, ADA, BNB, LINK, XLM",Bitcoin is taking a breather after the recent rally while altcoins are attempting to play catch up.
2025-04-25,"Price analysis 12/23: BTC, ETH, XRP, LTC, BCH, LINK, BNB, ADA, DOT, XLM",The SEC’s lawsuit against Ripple may be bearish for a few altcoins but could be bullish for Bitcoin.
2025-04-25,"Price analysis 12/21: BTC, ETH, XRP, LTC, BCH, LINK, ADA, DOT, BNB, XLM","Even with today's correction, Bitcoin is still in an uptrend, but most major altcoins have lost momentum and may remain range-bound for the next few days."
2025-04-25,"Price analysis 12/18: BTC, ETH, XRP, LTC, BCH, LINK, ADA, DOT, BNB, XLM",A handful of altcoins look ready to move higher as Bitcoin price enters a short consolidation phase.
2025-04-25,"Price analysis 1/15: BTC, ETH, XRP, DOT, ADA, LTC, BCH, LINK, XLM, BNB","Altcoins have entered a slight correction after Bitcoin's relief rally lost steam and the price dropped below $35,000."
2025-04-25,Polkadot gains 75% in one week — But can DOT price reach $20 next? ,The price of DOT is getting close to $20 but a pullback shouldn't be ruled out after such a strong rally.
2025-04-25,"1/18: BTC, ETH, DOT, XRP, ADA, LTC, BCH, LINK, XLM, BNB","Altcoins are beginning to lose bullish momentum as Bitcoin price struggles to reclaim $40,000."
2025-04-25,Ethereum price inches closer to a new all-time high as Bitcoin consolidates,"Ethereum price is in hot pursuit of a new all-time high, while Bitcoin price continues to trade sideways."
2025-04-25,"Price analysis 2/8: BTC, ETH, ADA, XRP, DOT, BNB, LTC, DOGE, LINK, BCH",Strong institutional demand has propelled Bitcoin and many altcoins to new all-time highs.
2025-04-25,"Top 5 cryptocurrencies to watch this week: BTC, DOT, LINK, XLM, THETA","Bitcoin is facing rejection above $40,000, but if the bulls do not give up much ground, several altcoins could resume their uptrend."
2025-04-25,Growing list of billion-dollar crypto ‘unicorns’ suggest the best is yet to come ,"More than 53 blockchain projects have emerged as multi-billion dollar market cap crypto unicorns, a signal that the 2021 bull market is just getting started."
2025-04-25,"Price analysis 2/5: BTC, ETH, XRP, DOT, ADA, LINK, LTC, BNB, BCH, XLM","Altcoins are reaching multi-year highs while Bitcoin price builds momentum for the next run at the $40,000 level."
2025-04-25,"Price analysis 2/3: BTC, ETH, XRP, DOT, ADA, LINK, LTC, BCH, BNB, XLM",Ethereum's rally to a new all-time high boosted investor sentiment in Bitcoin and several altcoins are now surging toward new highs.
2025-04-25,Manta aims to bring a private decentralized exchange to Polkadot with $1.1M raise,Manta Network may be the first DEX to fully shield its activity from prying eyes.
2025-04-25,21Shares to list Polkadot ETP on Swiss SIX exchange,21Shares’s Crypto Basket ETP has also replaced Bitcoin Cash with Polkadot.
2025-04-25,"Price analysis 2/1: BTC, ETH, XRP, DOT, ADA, LINK, LTC, BCH, BNB, XLM","Bitcoin price is trading in a tight range, which is allowing multiple altcoins to push higher."
2025-04-25,"Price analysis 1/29: BTC, ETH, DOT, XRP, ADA, LINK, LTC, BCH, BNB, XLM","Bitcoin’s surprise rally to $38,500 lifted sentiment across the market but the temporary boost appears to be losing steam."
2025-04-25,Moonbeam’s PureStake raises $6M ahead of parachain launch on Polkadot,The company building Moonbeam is focusing on integration work and a renewed marketing push.
2025-04-25,Grayscale prepares for DeFi future with new cryptocurrency trust filings ,The world's largest cryptocurrency asset management firm could be set to dip its toes into DeFi after filing five new coin trust registrations.
2025-04-25,"Price analysis 1/25: BTC, ETH, DOT, XRP, ADA, LINK, LTC, BCH, BNB, XLM","Altcoins continue to trend higher, but Bitcoin price needs to turn $35,000 to support in order for the entire market to gain momentum."
2025-04-25,"Top 5 cryptocurrencies to watch this week: BTC, ETH, DOT, AAVE, SNX","Select altcoins are rallying to new all-time highs while Bitcoin remains pinned below $33,000."
2025-04-25,Aave and Chainlink hit new highs as Bitcoin price fights to hold $32K,"Chainlink and Aave soared to a new all-time high as Bitcoin bulls struggle to hold BTC price above $32,000."
2025-04-25,"Price analysis 1/22: BTC, ETH, DOT, XRP, ADA, LTC, LINK, BCH, BNB, XLM",Bitcoin price has rebounded above a key trendline but resistance at higher levels may limit the recovery in altcoins.
2025-04-25,3 ways the next altcoin bull cycle will vastly differ from 2017’s,"Bitcoin is still the main focus of most investors but Layer 2 solutions, governance, and DeFi are shaping up to be the driving forces of the next altseason."
2025-04-25,"As DeFi booms, Ethereum’s blockchain competitors are catching up",Decentralized finance participants eye a “multichain” future as Ethereum’s DeFi-powering peers continue to attract users and projects.
2025-04-25,"Bitcoin price searches for support near $35K, DeFi tokens move higher","DeFi tokens moved higher while Bitcoin price struggles to hold $35,000 as support."
2025-04-25,"Price analysis 1/20: BTC, ETH, DOT, XRP, ADA, LTC, BCH, LINK, XLM, BNB","Bitcoin price continues to drop, pushing select altcoins closer to their critical support levels. "
2025-04-25,3 key reasons why Polkastarter (POLS) price rallied 500% since December,"New partnerships, interest in initial decentralized exchange offerings and the success of Polkadot back Polkastarter’s impressive 500% rally."
2025-04-25,"Price analysis 1/27: BTC, ETH, DOT, XRP, ADA, LINK, LTC, BCH, BNB, XLM","Bitcoin's dip below $30,000 triggered a sell-off in altcoins and dip-buying traders might not have enough momentum to cause a relief rally. "
2025-04-25,Acala wins first Polkadot parachain auction with over 32M DOT staked ,"The upcoming Polkadot DeFi hub raised nearly $1.3 billion from approximately 25,000 contributors in its token ICO. "
2025-04-25,"Price analysis 5/4: BTC, ETH, BNB, SOL, XRP, LUNA, ADA, DOGE, AVAX, DOT","Bitcoin and most altcoins could remain volatile in the short-term due to the Fed’s decision, warranting caution from traders."
2025-04-25,"Finance Redefined: Acala wins Polkadot parachain, and Iota set to launch Shimmer, Nov. 12–19 ","Acala was victorious in Polkadot’s first parachain auction, Iota announced its staking network and Uniswap liquidity providers lose money — all coming to you in this week’s Finance Redefined. "
2025-04-25,"Price analysis 4/28: BTC, ETH, BNB, XRP, ADA, DOGE, MATIC, SOL, DOT, LTC","Bitcoin and select altcoins continue to face selling at higher levels, a sign that the bears have not yet given up. "
2025-04-25,MeWe social network with 20M users to integrate with Polkadot parachain,"The integration is built on DSNP, a protocol created by Project Liberty."
2025-04-25,How to stake Polkadot (DOT),Still haven’t figured out how to stake Polkadot (DOT)? Worry not; this article provides a step-by-step guide on where and how to stake DOT.
2025-04-25,"Nifty News: Yuga Labs scores court battle win, Mandala Metaverse to drop on Polkadot and more…","A metaverse/AR story game is coming to Polkadot, Square Enix has made another Web3 gaming play, and an NFT esports cricket game has launched on Tezos. "
2025-04-25,"Price analysis 4/21: BTC, ETH, BNB, XRP, ADA, DOGE, MATIC, SOL, DOT, LTC",Bitcoin and select altcoins have fallen below their respective support levels — a worrying sign that the bulls could be losing their grip. 
2025-04-25,"Price analysis 4/19: BTC, ETH, BNB, XRP, ADA, DOGE, MATIC, SOL, DOT, LTC","Bitcoin and select altcoins turned down sharply on April 19, but a minor positive is that the bulls are trying to defend their respective support levels. "
2025-04-25,"Price analysis 4/14: BTC, ETH, BNB, XRP, ADA, DOGE, MATIC, SOL, DOT, LTC","Bitcoin hit a year-to-date high at $31,000 and ETH’s price followed. Which altcoins will be next?"
2025-04-25,"Price analysis 4/12: BTC, ETH, BNB, XRP, ADA, DOGE, MATIC, SOL, DOT, LTC","Today's CPI report highlighted a slight decline in inflation, a development which could put a strong price floor beneath Bitcoin and select altcoins. "
2025-04-25,"Price analysis 4/7: BTC, ETH, BNB, XRP, ADA, DOGE, MATIC, SOL, DOT, LTC","Bitcoin’s failure to clear the overhead resistance at $30,000 is attracting profit-booking in select altcoins."
2025-04-25,"Price analysis 4/5: BTC, ETH, BNB, XRP, ADA, DOGE, MATIC, SOL, DOT, LTC","Bitcoin continues to face resistance near $29,000 and Ether has decided to take charge of the wider crypto markets' bullish momentum."
2025-04-25,Astar Network to launch smart contracts that support two virtual machines ,The Astar Network team claimed that having two virtual machines is a key success factor in a budding layer-1 blockchain.
2025-04-25,"Price analysis 3/31: BTC, ETH, BNB, XRP, ADA, DOGE, MATIC, SOL, DOT, LTC",Signs of easing inflation could push Bitcoin and select altcoins above their respective overhead resistance levels in the short term. 
2025-04-25,"Price analysis 3/29: BTC, ETH, BNB, XRP, ADA, DOGE, MATIC, SOL, DOT, LTC","Bitcoin and select altcoins are close to breaking out of their overhead resistance levels, indicating that bulls remain in control of the crypto market. "
2025-04-25,"Price analysis 3/24: BTC, ETH, BNB, XRP, ADA, DOGE, MATIC, SOL, DOT, LTC",Bitcoin and altcoins could see profit-taking and risk-off positioning as the weekend approaches and investor concerns about Deutsche Bank arise.
2025-04-25,"Price analysis 3/22: BTC, ETH, BNB, XRP, ADA, DOGE, MATIC, SOL, DOT, SHIB","Technical charts are beginning to suggest that BTC is at the end of its bear market cycle, and traders believe this could yield positive results for most altcoins."
2025-04-25,"Price analysis 3/17: BTC, ETH, BNB, XRP, ADA, DOGE, MATIC, SOL, DOT, SHIB","Bitcoin has risen above $25,000, and if bulls flip this level into support during the next pullback, it will signal the start of a new up-move to $32,000."
2025-04-25,"Price analysis 3/15: BTC, ETH, BNB, XRP, ADA, DOGE, MATIC, SOL, DOT, SHIB","Credit Suisse has pulled the U.S. equities markets lower, but a positive sign is that Bitcoin and select altcoins are holding near their local highs."
2025-04-25,"Price analysis 3/10: BTC, ETH, BNB, XRP, ADA, DOGE, MATIC, SOL, DOT, SHIB","The February United States jobs report was a mixed bag, which seems to have provoked interest from a few bulls in BTC and altcoins. "
2025-04-25,"Price analysis 3/8: BTC, ETH, BNB, XRP, ADA, DOGE, MATIC, SOL, DOT, LTC","The strength in the U.S. dollar suggests that the risky assets may remain under pressure in the near term, but Bitcoin and select are showing signs of resilience."
2025-04-25,"Price analysis 5/3: BTC, ETH, BNB, XRP, ADA, DOGE, MATIC, SOL, DOT, LTC ","Bitcoin and select altcoins are showing a continuation pattern, indicating indecision among the bulls and the bears."
2025-04-25,"Price analysis 3/3: BTC, ETH, BNB, XRP, ADA, DOGE, MATIC, SOL, DOT, LTC","Concerning news from Silvergate Bank and FTX may have influenced investors’ decision to press the sell button, but the potential for further downside could be limited."
2025-04-25,"Price analysis 5/5: BTC, ETH, BNB, XRP, ADA, DOGE, MATIC, SOL, DOT, LTC","Ether has broken out of its triangle, and that may pull the Bitcoin price above $30,000."
2025-04-25,"Price analysis 5/10: BTC, ETH, BNB, XRP, ADA, DOGE, MATIC, SOL, DOT, LTC","Bitcoin and select cryptocurrencies are trying to start a rebound following the CPI data release, but bulls may find it difficult to continue the recovery at higher levels."
2025-04-25,"Price analysis 7/5: BTC, ETH, BNB, XRP, ADA, DOGE, SOL, LTC, MATIC, DOT","Bullish crypto traders are struggling to clear the overhead barrier in Bitcoin and select altcoins, indicating that bears have not given up yet."
2025-04-25,"Price analysis 7/1: BTC, ETH, BNB, XRP, ADA, DOGE, SOL, LTC, MATIC, DOT","The rejection of ETF applications by the SEC caused a knee-jerk reaction, but the shallow fall in Bitcoin and several altcoins suggests that lower levels are attracting buyers."
2025-04-25,Forget about price! Polkadot Decoded 2023 says bear markets are for building,The mantra of this year’s Polkadot Decoded 2023 conference is to focus on building better products instead of worrying about token price. 
2025-04-25,"Price analysis 6/28: BTC, ETH, BNB, XRP, ADA, DOGE, SOL, LTC, MATIC, DOT","Bitcoin and several altcoins are stuck in a tight range, indicating that a breakout is brewing. "
