date,headline,summary
2019-02-01,Developers Behind Ethereum App Aragon Weigh Launching a Second Network on Polkadot,Developers behind ethereum-based application Aragon are investigating the use of Parity Technologies' Polkadot Network to launch a smart contract framework.
2019-02-18,Ethereum Core Developer Quits Over 'Conflict of Interest' Attacks,A long-time contributor to the ethereum codebase is taking a step back from social media after tweeting contentious remarks.
2019-03-20,"Lock Up Ether, Get Free Crypto: Twist on Airdrops Attracts Top VCs","Governance startup Commonwealth, which offers a new twist on token airdrops, has raised $2 million from a group of notable investors."
2019-04-30,Voters on Ethereum App Veto Proposal to Fund Polkadot Blockchain,Aragon token holders have shot down a proposal to diversify project funds to support blockchain interoperability project Polkadot.
2019-05-12,Ethereum's Reddit Moderators Resign Amid Controversy,Controversy surrounding Reddit moderation in the ethereum community has led to mods resigning and new practices being codified on the forum.
2019-06-05,$1 Billion Valuation May Elude Ethereum Co-Founder’s New Blockchain Polkadot,"Polkadot’s bid for unicorn status has hit a snag, with three Chinese funds buying into the token sale at valuations below $1 billion."
2019-06-27,"Ethereum Co-Founder's Polkadot Closes Token Sale, Claims $1.2 Billion Valuation",Polkadot has closed on a private token sale that it says values the blockchain interoperability project as a tech unicorn.
2019-07-16,Polkadot Tokens Valued at $75 Pre-Launch in Crypto ‘Futures’ Offering,"They don't exist yet, but you can soon buy Polkadot tokens from CoinFLEX via a new mechanism: the initial futures offering (IFO)."
2019-07-16,'Expect Chaos': Polkadot to Launch Experimental Kusama Network This Summer,"Polkadot will be launching an experimental ""canary network"" called Kusama for early application testing and development."
2019-08-23,Web3's Gavin Wood Launches Kusama Network to Test Polkadot Protocol,The Web3 Foundation launched a live experimental version of the Polkadot network on Friday. Here's what Kusama will be testing.
2019-10-29,"Polychain, Web3 to Back Polkadot Projects With New Ecosystem Fund","""The investment committee is looking for projects that will add long-term value to the Polkadot ecosystem."""
2019-11-12,Web3 Studying How to Integrate Kadena's Smart Contract Language on Polkadot,The Web3 Foundation is studying how to adopt blockchain startup Kadena’s smart contract programming language for the Polkadot ecosystem.
2020-01-30,"'One Network, Many Chains' – The Case for Blockchain Interoperability","Inter-blockchain communication (IBC) is poised to be a major theme of 2020. And, like most trends in crypto, it has its fair share of hope, hype and haters."
2020-02-25,Polkadot to Use Chainlink Oracles for Interoperability Network,Polkadot will be the first non-ethereum blockchain to integrate Chainlink.
2020-03-05,Web3 Foundation Funds Technical Bridge Connecting Polkadot to Bitcoin,Web3 has awarded grants to more than 100 projects building on Polkadot.
2020-03-31,IoT App Nodle Moves From Stellar Blockchain to Polkadot,IoT platform Nodle announced it is switching from the Stellar blockchain to a custom build on Parity Technologies’ Substrate network.
2020-04-06,Shyft Network to Build FATF-Compliant 'Identity Layer' for Polkadot,Shyft Network is adding yet another blockchain to its decentralized digital identification network.
2020-04-07,Ready Layer One: Base Layer Protocols Team for Virtual Developer Event,"A virtual conference is being organized by a bevy of base-layer protocols – the Web3 Foundation, Near, Cosmos, Tezos, Protocol Labs and Polkadot."
2020-04-14,Coinbase Custody to Support Polkadot Staking With up to 20% Returns,Coinbase Custody is partnering with Bison Trails to add staking support for Polkadot’s native DOT tokens in anticipation of the network’s mainnet launch.
2020-05-06,'Very Near Launch': Polkadot Founder Gavin Wood Details Network Rollout,"Polkadot founder Gavin Wood outlined the “five or six” steps the network will be taking as it moves to a full launch, some four years after first being conceived, during his Ready Layer One presentation."
2020-05-11,Parity’s Gavin Wood Takes a Swipe at Ethereum,"Gavin Wood, an original co-founder of Ethereum, took a few good swipes at the second-largest cryptocurrency he helped create at Consensus: Distributed."
2020-05-11,Chainlink’s Sergey Nazarov on the Growth of Polkadot,Sergey Nazarov sits down with Will Foxley to talk about Polkadot at ETHDenver
2020-05-26,Polkadot Goes Live as Web3 Foundation Pushes Prospective Mainnet,"Polkadot is now live, following the launch of its first “chain candidate” (CC1)."
2020-06-18,Polkadot Is Latest Blockchain to Explore Redeemable Bitcoin Tokens,"It's only a proof-of-concept at this point, but there's now a model for locking BTC on the Bitcoin blockchain and minting PolkaBTC on Polkadot."
2020-06-19,"Bitcoin News Roundup for June 19, 2020","With BTC miners HODLing, Reddit dreaming big and a crypto card issuer missing billions of dollars and drawing comparisons to Enron, CoinDesk's Markets Daily is back with another Bitcoin news roundup."
2020-07-13,"Polkadot's Inaugural Vote Could Expand DOT Supply by 1,000x","The first vote on Polkadot will be to see whether the DOT supply should be redenominated by a ""logical"" 100x or even by 1,000x."
2020-07-27,Polkadot Raises $43M in 72-Hour Private Sale: Source,"A second private sale of the Polkadot token (DOT) has netted some 3,982.07 BTC worth an estimated $43.3 million as of press time, according to sources."
2020-07-28,Proof-of-Stake Chains Team Up to Prove DeFi Is Bigger Than Ethereum,"Terra is joining forces with Cosmos, Web3 Foundation and Solana to roll out a DeFi product meant for a wider consumer audience. Meet Anchor."
2020-08-06,"Polkadot Releases Rococo, Its Test Environment for Interoperable 'Parachains'","Polkadot has released its first testnet, Rococo, for its parachain network. The testnet will commence with three parachains, Parity Technologies said."
2020-08-12,Token Sales Are Back in 2020,"As the price of bitcoin rises, token sales have become trendy once more. Here's how Avalanche, Polkadot and NEAR have fared in 2020."
2020-08-24,First Mover: Anything-Goes Token Market Repudiates Rich-Only Venture Capital Club,"Venture capital is no longer just for the rich, as crypto markets let traders bet on early-stage digital-asset startups, risks included."
2020-08-27,"Developers Eye Mid-September for Ethereum, Polkadot Bridge Proof-of-Concept","The Snowfork proof-of-concept acts as a two-way bridge between the Ethereum and Polkadot ecosystems, according to the group."
2020-08-27,Polkadot-Based Acala Raises $7M as DeFi Grabs Land on Another Blockchain,"Acala, a DeFi startup building on the Polkadot blockchain, has closed a $7 million simple agreement for future tokens (SAFT) led by Pantera Capital."
2020-09-10,Swisscom Blockchain Wins Grant From Web3 to Help Toughen Polkadot’s Proof-of-Stake Network,Swisscom Blockchain has been awarded a grant from the Web3 Foundation to build a cloud-based protection layer for the Polkadot network.
2020-09-16,Polkadot Projects Will Be Able to Mint Their Own Tokens in 2021,"A token minting system is coming to the Polkadot blockchain ecosystem, promising to be a leaner, meaner version of Ethereum’s ERC-20 standard."
2020-09-23,Parity Upgrades Polkadot's Underlying Tech to Make Custom Blockchain Building Easier,"Polkadot developer Parity Technologies has released the second version of its blockchain building kit Substrate 2.0, including 70 composable modules."
2020-09-30,Reef Finance Raises $3.9M for Cross-Chain DeFi on Polkadot,DeFi on Ethereum is costly and congested. Can other base layers step up? Polkadot's Reef Finance has raised $3.9 million to try.
2020-10-23,BitMEX Delves Deeper Into DeFi With New Futures Listings,"BitMEX is soon to offer futures contracts for DeFi project yearn.finance (YFI), Polkadot (DOT) and Binance coin (BNB)."
2020-10-30,Polkadot Investor KR1: ‘You Can See Polkadot as Being a Kind of Ethereum That Fixes Some of the Problems’,"KR1 Managing Partner Keld van Schreven joins CoinDesk senior markets reporter Daniel Cawrey to discuss why the firm is heavily invested in Polkadot, which is considered an up-and-coming rival to Ethereum."
2020-11-17,"As DeFi Grows, Investors Look to Polkadot to Be the Next Ethereum","In a cryptocurrency ecosystem where the programmable-money juggernaut has long been Ethereum, Polkadot, a project that has been quietly developing an alternative solution since 2016, is ready to take on the blockchain world."
2020-11-17,"First Mover: Bitcoin Tops $17K as Scaramucci Makes Entrée, Ethereum Meets Rival","Ethereum's success as dominant ""smart contracts"" blockchain attracts rivals, and some investors speculate Polkadot might have momentum."
2020-11-24,"IDEX Plants a Flag for a Multichain Future, Beginning With Binance Chain and Polkadot",Every holder of IDEX’s Ethereum tokens will get an equivalent number of exchange tokens for each of the new chains.
2020-11-25,"China's State-Sanctioned Blockchain Project BSN Adds Polkadot, Oasis, Bityuan to Network","China’s state-sanctioned blockchain infrastructure provider BSN is adding cross-chain protocol Polkadot, decentralized cloud data startup Oasis and China-based project Bityuan to its network."
2020-12-03,Protocol Hosting Google reCAPTCHA Competitor Expands to Polkadot,"Human Protocol, home of the anti-bot hCaptcha system, announced it is expanding beyond Ethereum to a future Polkadot parachain, Moonbeam."
2020-12-23,Cere Network Raises $1.5M More to Bring Its 'Decentralized Salesforce' to Polkadot,Binance-backed Cere Network has raised another $1.5 million to become a decentralized version of Salesforce.
2020-12-29,"Polkadot Surges After Binance Home Page Listing, $10M Endorsement",DOT's recent ascent began on Dec. 23 when Binance announced a $10 million fund to support projects built on Polkadot.
2021-01-06,Kraken Users Are Staking More Than $1B in Crypto,The value reflects the many long positions investors are trading in cryptocurrencies.
2021-01-14,"Fireblocks Rolls Out Staking Rewards for Eth 2.0, Polkadot and Tezos",The institution-focused crypto custodian is bringing staking services to its 165-plus customers.
2021-01-16,K-Pop Stars to Mint Digital Collectibles on Polkadot,RBW's Japanese subsidiary will be selling its singers' digital products on the blockchain.
2021-01-20,"Salesforce, Lime Execs Join Board of Polkadot-Inspired Cere Network",Cere’s new board members don’t want a “half-assed approach” to enterprise blockchain.
2021-02-02,21Shares Launching First Polkadot ETP on SIX Exchange,The Polkadot ETP (PDOT) will list on the Swiss SIX Exchange on Thursday.
2021-02-03,"Ether Soars to Another All-Time High, Carrying DeFi and Rival Coins With It",Investor excitement ahead of the CME's planned ether futures contract is one reason for the price push.
2021-02-04,"First Mover: Ethereum, DOGE on Own Journeys as Inflation Bets Fuel Bitcoin","Altcoins like Chainlink get big boost from DeFi growth on Ethereum, while inflation bets boost bitcoin and dogecoin gets (Elon Musk) moonshot."
2021-02-08,"Cardano, Polkadot Market Caps Surpass XRP as Some Bet on Alternatives to Ethereum","The price of gas continues to rise on Ethereum, squeezing smaller retail traders using DEXs."
2021-02-09,DeFi's Curve Finance Is Branching Out to Polkadot,It costs a lot to swap assets on Ethereum. That's why Equilibrium is building a cross-chain version of Curve Finance on Polkadot.
2021-02-17,"Goldman Sachs, JPMorgan, UBS Are Trading an ETP Tied to Polkadot’s Crypto","The purchases suggest institutional investors’ appetite for crypto exposure in the bull market goes far beyond bitcoin, or even ether."
2021-02-18,"Blockchain Data Indexer 'The Graph' to Support Polkadot, Solana, NEAR and Celo",The project’s custom API “subgraphs” provide data to some of Ethereum’s top DeFi apps.
2021-02-18,"Clover Finance Raises $3M From Polychain, Others to Bridge Ethereum and Polkadot",The Substrate-based chain is also working on a proof-of-concept “non-custodial” bridge for EVM chains to connect with the Bitcoin network.
2021-03-05,Binance Pledges New Controls After 99% 'Flash Crash' in Polkadot Futures,A single large sell order appears to have sent prices for trading contracts on polkadot tumbling from about $33 to 25 cents in less than a minute.
2021-03-12,Alameda Research Pumps $20M Into Cross-Chain DeFi Platform Reef Finance,"Sam Bankman-Fried's investment shop has bought $20 million in REEF tokens, with an eye to purchasing more."
2021-03-30,"PureStake Raises $6M From Binance Labs, Coinbase Ventures",PureStake's Moonbeam parachain launched its testnet in September as part of the Polkadot ecosystem.
2021-03-31,Enjin Raises $18.9M in Private Token Sale to Build Polkadot Parachain for NFTs,The EFI token sale will help Enjin build its NFT platform away from Ethereum's high gas fees.
2021-04-06,Tether’s USDT to Launch on Kusama With Polkadot to Follow,It’s slated to become the first stablecoin to launch on Polkadot.
2021-04-09,Visa and PayPal Can Be the Cosmos and Polkadot of CBDCs,"Existing payment players have a head start in the race to integrate central bank digital currencies worldwide, says our columnist."
2021-04-26,DeFi Reshapes the CoinDesk 20,The recent surge in DeFi activity is altering the crypto market.
2021-04-29,Osprey Funds Launches Polkadot Trust,"Crypto asset manager Osprey Funds has launched a Polkadot fund to give customers exposure to the DOT token. CEO Greg King joins ""First Mover"" to share why Osprey is bullish on DOT and the Polkadot ecosystem and why he thinks there is significant market demand for a Polkadot trust fund."
2021-04-30,"Valkyrie, Osprey Beat Grayscale to Market With Polkadot DOT Trust","Valkyrie is charging a 2% management fee on the fund, just under Osprey’s 2.5%. Are DOT funds the new BTC funds for buttoned-up investors?"
2021-05-04,DeFi Conglomerate Equilibrium Raises $8.5M to Win a Place on Polkadot,"Phase one for the project reached its 250,000 DOT token hard cap. Phase two is looking to net the remaining 750,000 DOT required to land a parachain."
2021-05-06,Market Wrap: 'Ethereum Killers' Pop as ING Report Highlights Ethereum Over Bitcoin,"Atcoins are rising, ether hits another all-time high and bitcoin’s correlation to gold drops to zero."
2021-05-06,Ethereum Co-Founder Anthony Di Iorio: ‘I Don’t See Things Stopping for Ether’,"Ether is booming, setting new all-time highs almost daily, but what’s behind the cryptocurrency’s recent success? Ethereum co-founder Anthony Di Iorio joins “First Mover” to discuss the bull market driving Ether’s rise, Canadian ETFs, and the NFT craze. Plus, his thoughts on “Ethereum killer” projects like Polkdadot and Cardano."
2021-05-12,Market Wrap: DeFi Tokens Aave and Uniswap Climb While ETH and BTC Dump,"“The crypto market is primarily focused on Ethereum and the catapulting DeFi sector right now,” said one analyst."
2021-05-12,How the Cosmos Network Unites Blockchains and Compares to Polkadot,"The Cosmos network aims to enable blockchains to work together, but how is it different from the Polkadot chain, and what does Cosmos mean for traders? Cosmos Network Core Developer Jack Zampolin breaks it down."
2021-05-13,Market Wrap: Bitcoin Falls for Second Straight Day After Tesla Action; Ether Follows,"“What saddens me is the way the weak hands and recent buyers see Elon Musk as a prophet, powerhouse and decisive figure in bitcoin,” said one trader."
2021-05-13,Polkadot-Based Derivatives Exchange Raises $6.4M at $50M Valuation,Su Zhu’s Three Arrows co-led the funding round for dTrade. The project looks to decentralize crypto derivatives trading.
2021-05-14,Market Wrap: It's 'Doge Day Afternoon' as Memecoin Jumps 47%; Ether and Bitcoin Rise,Not all industry participants are amused by dogecoin’s tricks.
2021-05-18,Swiss Asset Manager Valour Launches Cardano and Polkadot ETPs,"Fully backed by ADA and DOT, the products are listing on the Nordic Growth Market."
2021-05-18,Banking App Current Picks Polkadot for Its DeFi Debut,The banking app with 3 million users will serve as a Polkadot validator as it plans deeper crypto moves.
2021-05-18,Banking App Current Picks Polkadot for its DeFi Debut,"Fintech firm Current announced that it will become more active in the Polkadot space. Current will serve as a validator on the Polkadot network and plans to integrate Acala, a Polkadot-based decentralized finance (DeFi) platform, into its banking app."
2021-05-21,"Market Wrap: China Breaks Crypto as Bitcoin Falls to $36K, ETH Drops $300 in Two Hours","Within two hours of the State Council statement, BTC fell 11%, based on CoinDesk 20 data."
2021-05-24,Polkadot Weighs Multichain Tech Challenges Ahead of DOT 'Parachain' Auctions,"Polkadot’s interconnected web of blockchains will require “a totally different application programming paradigm,” said Web3 Foundation tech lead Joe Petrowski."
2021-05-25,Polkadot’s Wood Acknowledges Legacy EVM Design’s Role But Ties Future to Upgrades,"Speaking at Consensus 2021, Parity Technologies founder Gavin Wood discussed changes to Polkadot, using WebAssembly as a smart contract and how legacy blockchains are not fit for modern day use, though he acknowledged the Ethereum Virtual Machine’s (EVM) pole position in blockchain development today."
2021-05-25,"Polkadot’s Gavin Wood: WebAssembly Is the Future of Smart Contracts, but ‘Legacy’ EVM Is Right Now","“It's super important to support these legacy protocols, these legacy languages, and that's what we're doing,” says the former Ethereum developer."
2021-05-25,"Market Wrap: Ether Trading Volume Up, Closing In on Bitcoin; Crypto Market Struggles",Action in the ether market might take the spotlight from bitcoin over time due to very different mechanics between the two assets.
2021-06-02,Master Ventures Launches $30M Polkadot Fund,This first-of-its-kind fund will invest in projects bidding for parachain slots on Polkadot and canary network Kusama.
2021-06-08,Polkadot’s Kusama Network to Start Parachain Auctions Next Week,"The start date was heralded by the upgrade to Kusama’s Statemine parachain, Polkadot founder Gavin Wood said Tuesday."
2021-06-08,Kraken Now Lets Users Back Contender Projects on Polkadot's Kusama Platform,"Kraken is adding support for Kusama parachain auctions, allowing users to effectively vote for their favorite projects."
2021-06-10,DeFi Network Karura Raises $100M Ahead of Kusama's Parachain Auction,"The money came from a ""crowd loan"" and included more than 8,500 contributors."
2021-06-10,Market Wrap: Bullish Basel News Causes BTC Jump to Week-High $38K Level; ETH Slips,Bitcoin busted out a quick 5% gain early Thursday on positive news from that continent before losing some steam.
2021-06-11,Market Wrap: Bitcoin Flat at $37K as Investors Tangle With Bulls and Bears,Positive news from El Salvador couldn't completely overcome negative news out of China.
2021-06-11,Stake Technologies Raises $10M  Ahead of Polkadot and Kusama Auctions,"With auctions to win a place building on the Polkadot blockchain ecosystem beginning soon, projects are coming out with strategies to secure one of the coveted slots."
2021-06-14,"Lending Startup Parallel Finance Raises $2M to Bring More DeFi to Polkadot, Kusama",Pantera and Polychain are backing the project.
2021-06-14,Coinbase Adds Polkadot Trading to Pro Platform,Trading will begin on or after 9 a.m. PT Wednesday.
2021-06-18,"Security Audit Firm Raises $5.3M From Funds Investing in Polkadot, Cardano Blockchains","Runtime Verification checks smart contracts for errors, perhaps most famously with Uniswap."
2021-06-22,Polkadot on Coinbase Went Up More Than 70% in the Midst of Crypto Market Sell-Off,DOT was one of the day's biggest winners.
2021-06-22,DeFi Network Karura Wins First Auction Slot on Kusama,"More than 15,000 network stakeholders locked up KSM in favor of Karura being added."
2021-07-23,First Decentralized Exchange Launches on Polkadot and Kusama Ecosystem,Karura Swap opened for trading with $3.4 million in total value locked.
2021-07-29,EU-Backed Investment Fund Puts $30M Into Crypto VC Firm's New $130M Vehicle,The backing of Fabric Ventures marks the first time a fund affiliated with the European Commission has invested in digital assets.
2021-08-30,Polkadot’s Parallel Finance Raises $22M at $150M Valuation,The startup wants to become a DeFi “brand” across multiple blockchains.
2021-09-01,Solana’s SOL Token Nearly Tripled in August as Investors Bet on ‘Ethereum Killers’,Terra’s LUNA and Cardano’s ADA also surged as Ethereum’s scalability issues pushed investors to speculate on alternative DeFi base layers.
2021-09-07,Former Libra Director Joins Polkadot Builder,Bertrand Perez is joining the Web3 Foundation as chief operating officer after resigning from the Facebook-linked Diem in July.
2021-09-07,Former Libra Director Joins Polkadot Builder,"Bertrand Perez, the former chief operating officer (COO) of the Facebook-backed Diem stablecoin project, is joining the Web3 Foundation, a backer of the Polkadot blockchain, as COO. ""The Hash"" group discusses what this could signal about the future of Diem and Polkadot and the possible impact on stablecoin regulation."
2021-09-08,SubQuery Gets $9M in Series A to Improve Access to Blockchain Data on Polkadot,"Funding will go toward accelerating SubQuery’s technical and community roadmap, among other pursuits."
2021-09-13,Solana Funds Outshined Bitcoin Last Week Amid Down Market,"Crypto funds focused on Solana’s SOL token garnered almost $50 million of inflows last week, while bitcoin funds brought in a “paltry” $200,000."
2021-09-21,Polkadot’s Gavin Wood: DeFi Regulation Is ‘a Good Thing’,"Gavin Wood, CEO of smart contract blockchain Polkadot, which issues its native token DOT, discusses why regulation is good for DeFi, adding it would force projects and platforms to be truly decentralized, and it would weed out projects with more centralized elements."
2021-10-04,Crypto Funds Draw $90M in New Money as Confidence Returns,"Bitcoin-focused funds have attracted new capital for three straight weeks, after a period of outflows in recent months."
2021-10-13,Polkadot Sets Date for Hotly Anticipated Parachain Auctions,"There could still be minor changes to the schedule, but the first auction is slated to begin on Nov. 11."
2021-10-14,SEBA Bank Exec on Launching Program for Clients to Earn Yield With Crypto,"Digital asset platform SEBA Bank has introduced a product that will let clients earn a yield on their crypto holdings. Institutions can generate rewards from proof-of-stake protocols such as Polkadot, Tezos and Cardano, with other networks to be added over time. Urs Bernegger, Co-Head of Trading and Investment Solutions at SEBA Bank, discusses the launch, the role of Europe in DeFi, and his crypto markets assessment."
2021-10-14,Polkadot Sets Date for Hotly Anticipated Parachain Auctions,"The much-anticipated parachain auction process, where projects are allocated slots for building on the Polkadot smart contract blockchain, is slated to begin on Nov. 11. “The Hash” squad discusses the outlook for the Polkadot network following the latest step signaling the vision for an interconnected blockchain framework could be realized soon."
2021-10-21,Fintech App Current Taps Coinbase’s Bison Trails to Support Polkadot DeFi Plans,Current is enlisting back-end support in its bid to combine DeFi services with the best of its traditional offerings.
2021-10-27,DOT Holders Are Voting on Polkadot’s New Look,The interoperability protocol began a brand overhaul in January. Now the community can vote on the final outcome.
2021-11-04,Ethereum Alternatives and Gaming Tokens Outperform BTC and ETH,Solana’s SOL hit an all-time high of $246 on Wednesday and the token is up 5% in the last 24 hours. Polkadot (DOT) is up 7%.
2021-11-04,Ethereum Alternatives and Gaming Tokens Outperform BTC and ETH,"Bitcoin and ether were little changed over the past 24 hours. Yet, digital currencies associated with Solana and Polkadot, both alternatives to the Ethereum blockchain, were outperforming along with gaming tokens like Axie Infinity’s AXS. ""The Hash"" team discusses the rise of altcoins and wider crypto markets outlook."
2021-11-08,Sequoia Jumps Into Token Plays With Investment in DeFi Project Parallel,June filings show the VC giant has a relationship with Coinbase Custody.
2021-11-08,Crypto Fund Inflows YTD Significantly Higher Than Last Year,Total assets under management have also reached an all-time high of $80 billion.
2021-11-10,Polkadot DeFi Darling Acala Has Gathered Over $600M and Counting,Acala is likely to win the first Polkadot parachain slot in the auction process beginning Thursday.
2021-11-18,"Acala Wins First Polkadot Parachain Auction, With $1.3B in DOT Committed","Parachain auctions saw almost $3.5 billion collected by 10 hopefuls, with Acala edging out Moonbeam for the first slot."
2021-11-18,Polkadot Chief Promises Freedom From Ethereum’s ‘Economic Enslavement’,Polkadot creator (and Ethereum co-founder) Gavin Wood says Ethereum is actually closer to Bitcoin than many of its adherents would freely admit.
2021-11-26,Jutta Steiner Leaves Polkadot Builder Parity Technologies,"The CEO stepped away earlier this year after running the company since 2015, a Parity representative confirmed."
