date,headline,summary
2025-04-25,"Price analysis 6/30: BTC, ETH, BNB, ADA, DOGE, XRP, DOT, UNI, BCH, LTC","Bitcoin and altcoins are witnessing selling near key overhead resistance levels, but a shallow pullback may suggest further upside is in store. "
2025-04-25,"Price analysis 6/28: BTC, ETH, BNB, ADA, DOGE, XRP, DOT, UNI, BCH, LTC ",Select altcoins are looking to capitalize on Bitcoin’s range-bound trading below the 20-day moving average.
2025-04-25,"Price analysis 6/25: BTC, ETH, BNB, ADA, DOGE, XRP, DOT, UNI, BCH, LTC","Sellers are jumping on top of every breakout from Bitcoin and altcoins, indicating that the bears are in no hurry to let go of their advantage."
2025-04-25,"Price analysis 6/23: BTC, ETH, BNB, ADA, XRP, DOGE, DOT, UNI, BCH, LTC",The swift rebound in Bitcoin and altcoins indicates strong accumulation occurring at lower levels.
2025-04-25,Ambitious plans for interoperability unveiled at two-day blockchain conference,A blockchain application platform has unveiled an ambitious roadmap for interoperability at a two-day conference held especially for developers.
2025-04-25,DeFi hub Karura emerges as first Kusama parachain slot auction winner,"Polkadot’s canary network, Kusama, is set to see decentralized finance hub Karura become the first parachain."
2025-04-25,"Price analysis 6/21: BTC, ETH, BNB, ADA, XRP, DOGE, DOT, UNI, BCH, LTC","Bitcoin and altcoins are reaching critical support levels, but instead of buying the dip, traders are waiting to see if any bullish signals emerge."
2025-04-25,"Price analysis 6/18: BTC, ETH, BNB, ADA, DOGE, XRP, DOT, UNI, LTC, BCH","Traders expect further downside from Bitcoin and altcoins after BTC dropped below a key support level at $36,000."
2025-04-25,Advanced NFT’s ‘art legos’ will give tokens interactivity and long-lasting utility,"A decentralized project is building nonfungible tokens that can store other NFTs and get them to work together and take actions, even on smart contract-free blockchains."
2025-04-25,"Price analysis 6/16: BTC, ETH, BNB, ADA, DOGE, XRP, DOT, UNI, LTC, BCH","Bitcoin’s recent rejection at $41,000 could extend the current range-bound action for a few more days and altcoins are expected to follow suit."
2025-04-25,Another first for Polkadot as Kusama council approves first parachain slot auction,The first Kusama parachain slot auction will now commence and is set to run for the next week.
2025-04-25,Polkadot announces Kusama is ‘finally ready to host parachains’,"The rollout of the Polkadot protocol has been ongoing since August, when the project launched its Rococo testnet."
2025-04-25,"Price analysis 5/17: BTC, ETH, BNB, ADA, DOGE, XRP, DOT, BCH, LTC, UNI    ","Traders appear disinterested in buying Bitcoin at the current levels, suggesting that further downside could be in store for BTC and altcoins. "
2025-04-25,"Top 5 cryptocurrencies to watch this week: BTC, XRP, DOT, XLM, SOL","Bitcoin price remains under pressure but select altcoins like XRP, DOT, XLM and SOL are showing signs of resuming their uptrend."
2025-04-25,Kusama (KSM) price hits new highs as parachain auctions begin to take shape,KSM rallied to a new all-time high as investors rushed into new positions in order to participate in the hype surrounding the upcoming parachain auctions.
2025-04-25,Life beyond Ethereum: What layer-one blockchains are bringing to DeFi,"Ethereum is the dominant force in DeFi, and layer-two solutions are a promising alternative, but the layer-one blockchains are not done just yet. "
2025-04-25,Polkadot and Cosmos connect as Plasm and Secret Network release bridge MVP,The two projects seek to become the forerunners of Cosmos and Polkadot interoperability.
2025-04-25,"Price analysis 4/12: BTC, ETH, BNB, XRP, ADA, DOT, UNI, LTC, LINK, XLM","Altcoins continue to press higher while Bitcoin bulls work on holding the $60,000 level as support."
2025-04-25,"Price analysis 4/9: BTC, ETH, BNB, XRP, ADA, DOT, UNI, LTC, LINK, THETA",The rally in Bitcoin and select altcoins seems to have hit a wall as bears continue to aggressively push back at key overhead resistance levels.
2025-04-25,How will Sora’s price perform after the launch of Polkaswap?,Polkaswap leads the race to become the first decentralized exchange for Polkadot-based digital assets.
2025-04-25,Equilibrium raises $2.5M to secure support for Polkadot parachain bid,Major Polkadot ecosystem investors are backing the DeFi protocol.
2025-04-25,3 reasons Enjin Coin price surged by over 30% in a single day,"ENJ, the native token of the Enjin blockchain ecosystem, is up 31% in the last 24 hours for three key reasons."
2025-04-25,"Price analysis 4/7: BTC, ETH, BNB, XRP, ADA, DOT, UNI, LTC, LINK, THETA","Altcoins retraced to key lower support levels after Bitcoin price dropped below $56,000, but will traders view the dip as a buying opportunity?"
2025-04-25,Polkadot futures open interest hits $1B as DOT price reaches a new ATH,"The open interest of Polkadot futures soared to $1 billion, eclipsing Litecoin and XRP to make DOT the third-largest futures market."
2025-04-25,Tether’s stablecoin set to land on Polkadot and Kusama,The launch of parachain shards on Polkadot will also mean the release of Tether on the network.
2025-04-25,‘No more rug pulls’: Project eliminates human involvement from token distributions,"A Polkadot project says the crypto world is too reliant on humans having to trust other humans and has built a transparent, trustless model for distributing tokens."
2025-04-25,"Price analysis 4/5: BTC, ETH, BNB, DOT, ADA, XRP, UNI, LTC, LINK, THETA","Bitcoin and most major altcoins have bounced off their immediate support levels, indicating an increase in bullish sentiment. "
2025-04-25,Cross-chain DEX to be deployed on two layer-two solutions on Polkadot ,A project says it is going to be the first cross-chain DEX to be deployed on two layer-two solutions on Polkadot — lowering costs and increasing transactions throughput.
2025-04-25,"Top 5 cryptocurrencies to watch this week: BTC, ETH, BNB, DOT, EOS","The bullish price action from ETH, BNB, DOT and EOS show that altcoins have capitalized on Bitcoin’s range-bound trading below the $60,000 level. "
2025-04-25,"Price analysis 4/2: BTC, ETH, BNB, ADA, DOT, XRP, UNI, LTC, LINK, THETA",Select altcoins could rally higher if Bitcoin and Ethereum hold on to their recent gains. 
2025-04-25,Chainlink releases native Substrate module to bring its oracles to Polkadot,Polkadot parachains can now choose to add Chainlink price feeds to their runtime.
2025-04-25,Coinbase Ventures backing DeFi in the Polkadot ecosystem ,"The leading United States digital currency exchange is backing Acala, Polkadot’s all-in-one DeFi hub.  "
2025-04-25,"Price analysis 3/31: BTC, ETH, BNB, ADA, DOT, XRP, UNI, THETA, LTC, LINK",Bitcoin’s recovery from its recent lows and the stellar performance from altcoins signal that bulls are confident BTC will retest its all-time high.
2025-04-25,Enjin secures $18.9M funding for Polkadot-based NFT blockchain,"Amid the expanding nonfungible token metaverse, Enjin is set to debut the first-ever NFT blockchain built on Polkadot."
2025-04-25,"Price analysis 4/14: BTC, ETH, BNB, XRP, ADA, DOT, UNI, LTC, DOGE, LINK ",Today's Coinbase (COIN) listing is likely to remain a focal point that will dictate the short-term price action in Bitcoin and altcoins.
2025-04-25,"Price analysis 7/12: BTC, ETH, BNB, ADA, DOGE, XRP, DOT, UNI, BCH, LTC","Bitcoin price is drifting lower, pulling altcoins to critical support levels and testing the resolve of traders who were looking for a bullish reversal."
2025-04-25,Raise a PINT to Polkadot’s new index token: Six top projects sign up,Six of Polkadot’s top projects have already put their hands up to feature in the Polkadot Index Network Token and sit on its constituent council.
2025-04-25,"Price analysis 4/19: BTC, ETH, BNB, XRP, DOGE, ADA, DOT, LTC, BCH, UNI","After the initial oversold bounce, traders are struggling to sustain the momentum of the relief rally in Bitcoin and most altcoins, a signal that selling could intensify at higher levels."
2025-04-25,"Price analysis 5/14: BTC, ETH, BNB, DOGE, ADA, XRP, DOT, BCH, LTC, UNI ","Bitcoin is showing signs of topping out but many altcoins remain strong, a signal that the decoupling between the two is likely to continue for a few more days. "
2025-04-25,"Price analysis 5/13: BTC, ETH, BNB, ADA, DOGE, XRP, DOT, BCH, LTC, UNI",Bitcoin remains on slippery ground and the completion of a bearish candlestick pattern signals that further downside is possible for BTC and altcoins. 
2025-04-25,Polkadot-centric derivatives exchange raises $6.4M in seed funding ,DTrade is planning to build the first derivatives exchange on Polkadot following a highly successful private investment round.  
2025-04-25,"2 reasons why Casper (CSPR) IOU token rallied 2,300% in one week","CSPR appears to be following DOT’s route to success as its IOU token latched on to the bull market’s momentum and rallied 2,300% before it's even listed on major exchanges."
2025-04-25,"Price analysis 5/10: BTC, ETH, BNB, DOGE, XRP, ADA, DOT, BCH, LTC, LINK  ","Ethereum's increasing dominance has kept traders focused on altcoins but Bitcoin's struggle to hold above $59,000 could send the entire market tumbling."
2025-04-25,"Price analysis 5/7: BTC, ETH, BNB, DOGE, XRP, ADA, DOT, BCH, LTC, UNI   ","Altcoins continue to rally higher and Bitcoin's repeat tests of the $58,000 level signal that bulls are building momentum."
2025-04-25,"Price analysis 5/5: BTC, ETH, BNB, DOGE, XRP, ADA, DOT, LTC, BCH, UNI ",Bitcoin is trying to stage a comeback in order to catch up with the spectacular price action seen in Ethereum and other altcoins. 
2025-04-25,"Polkadot parachains full of promise, but lack of launch date raises concern","The parachain slot auctions are the next big milestone due on the Polkadot roadmap. So, what can we expect? "
2025-04-25,"Price analysis 5/3: BTC, ETH, BNB, XRP, DOGE, ADA, DOT, UNI, LTC, BCH ","Ethereum and a handful of altcoins have charged higher while Bitcoin struggles to find enough momentum to clear the $58,000 level."
2025-04-25,"Price analysis 4/30: BTC, ETH, BNB, XRP, ADA, DOGE, DOT, UNI, LTC, BCH","After days of range-bound action, Bitcoin and many altcoins made a strong comeback today, indicating buying at lower levels."
2025-04-25,We all know the issues with DeFi — but what are the answers?,High costs and transactions prioritized by gas fees often make using DeFi protocols challenging to say the least. Does it really need to be this difficult?
2025-04-25,DOT over the counter? Osprey Funds set to launch Polkadot investment trust,Accredited investors will soon have over the counter access to a DOT investment trust
2025-04-25,"Price analysis 4/28: BTC, ETH, BNB, XRP, ADA, DOGE, DOT, UNI, LTC, BCH","After a sharp relief rally, Bitcoin price encountered resistance near $55,000, leading to a short-term pullback in select altcoins. "
2025-04-25,"Price analysis 4/26: BTC, ETH, BNB, XRP, ADA, DOGE, DOT, UNI, LTC, BCH","Altcoins are notching double-digit gains as bulls push Bitcoin price back toward the $55,000 level."
2025-04-25,"Price analysis 4/23: BTC, ETH, BNB, XRP, DOGE, ADA, DOT, UNI, LTC, BCH",Bitcoin price continues to come under pressure from sellers while Ether and BNB are attempting to buck the trend. 
2025-04-25,"Price analysis 4/21: BTC, ETH, BNB, XRP, DOGE, ADA, DOT, UNI, LTC, BCH","Although Bitcoin is struggling to recover from its recent crash, Ethereum is pushing toward a new high and prompting several altcoins to rally."
2025-04-25,Project to provide easy-to-use multichain wallet and Ethereum-to-Polkadot bridge,"A smart contract platform aimed at the decentralized finance market seeks to make it easy to transfer DApps from clogged, expensive Ethereum to Polkadot. "
2025-04-25,Cardano and Polkadot extend staked capitalization dominance,"While Cardano and Polkadot are extending their staking dominance, Tezos has plummeted from the top 10 by staked capitalization.  "
2025-04-25,Are we there yet? Here’s why one analyst says its not ‘altcoin season’,"Altcoins have been on a real tear for months, but Jarvis Labs analyst Ben Lilly says we’re not in an ""alt season"" just yet."
2025-04-25,"Price analysis 4/16: BTC, ETH, BNB, XRP, DOGE, ADA, DOT, LTC, UNI, LINK",Bitcoin’s weakness and Dogecoin’s epic pump are signals that the market could be overheating and in need of a short-term correction.
2025-04-25,"Price analysis 7/14: BTC, ETH, BNB, ADA, XRP, DOGE, DOT, UNI, BCH, LTC","Bitcoin and most major altcoins are bouncing off strong support levels, indicating possible accumulation by the bulls."
2025-04-25,Bondly Finance urges users to stop trading following alleged exploit,The DeFi platform’s native token price dropped more than 60% following a compromise by an unknown party. 
2025-04-25,Dapp for Diem blockchain partners with Polkadot infrastructure provider ,"Pontem founder Boris Povod said the partnership was aimed at improving Polkadot’s current node infrastructure, with Pinknode providing “reliable and secure API endpoints.” "
2025-04-25,"Price analysis 10/20: BTC, ETH, BNB, ADA, XRP, SOL, DOT, DOGE, LUNA, UNI ","Bitcoin’s breakout to $67,000 also sent the total crypto market capitalization to a new all-time high and is a signal that altcoins could soon embark on a new uptrend."
2025-04-25,Polkadot-based privacy project Manta Network raises $5.5M,Manta Network will use newly raised funds to further scale DeFi use cases by boosting blockchain privacy.
2025-04-25,Polkadot unveils $770M development fund ahead of parachain auctions,Polkadot’s Gavin Wood has announced a more than $770 million development fund just weeks before the network’s parachain auctions are set to go live.
2025-04-25,"Price analysis 10/18: BTC, ETH, BNB, ADA, XRP, SOL, DOT, DOGE, LUNA, UNI","Altcoins are selling off ahead of this week’s Bitcoin ETF launch, perhaps a sign that traders are anxious about this historic listing."
2025-04-25,"Price analysis 10/15: BTC, ETH, BNB, ADA, XRP, SOL, DOT, DOGE, LUNA, UNI",Hopes of a BTC ETF approval sent Bitcoin charging toward a new all-time high and several altcoins are also breaking out of bullish setups.  
2025-04-25,Polkadot eyes breakout to $75 after DOT price rally sets up classic bullish reversal,The inverted head and shoulders pattern hints at a decisive breakout move in the Polkadot market.
2025-04-25,Bitcoin analyst ‘highly doubts’ return to $50K — Will the weekly close spark a correction?,"Bitcoin has never managed a weekly close above $60,000, and failing to do so again risks a reversal downhill, a new warning says."
2025-04-25,Polkadot to debut parachain auctions after governance vote ,The first series of auctions will begin on Nov. 11 and run until Dec. 9. 
2025-04-25,"Price analysis 10/13: BTC, ETH, BNB, ADA, XRP, SOL, DOGE, DOT, LUNA, UNI ","Bitcoin remains strong above its recent breakout level, but several major altcoins will be under pressure until BTC reveals its next move."
2025-04-25,Putting NFTs to work: Digital art project brings minting and farming together,A cross-chain DeFi and NFT farming project plans to release 400 collectible chimps as part of efforts to remove intermediaries and connect artists with audiences on the blockchain.
2025-04-25,"Price analysis 10/11: BTC, ETH, BNB, ADA, XRP, SOL, DOGE, DOT, LUNA, UNI",Analysts say Bitcoin has started its journey toward a new all-time high and the sideways action from altcoins suggests traders are shifting funds into BTC.
2025-04-25,"Top 5 cryptocurrencies to watch this week: BTC, DOT, UNI, LINK, XMR","Bitcoin could pick up momentum above $56,100 and that could attract buying in DOT, UNI, LINK, and XMR."
2025-04-25,"Price analysis 10/8: BTC, ETH, BNB, ADA, XRP, SOL, DOGE, DOT, LUNA, UNI","Bitcoin and select altcoins are facing selling at higher levels, indicating that short-term traders may be booking profits after the recent rally."
2025-04-25,"Price analysis 10/6: BTC, ETH, BNB, ADA, XRP, SOL, DOGE, DOT, LUNA, UNI", Bitcoin has surged above the overhead resistance and that has pulled several altcoins higher.
2025-04-25,"Price analysis 10/4: BTC, ETH, BNB, ADA, SOL, XRP, DOT, DOGE, LUNA, UNI","Bitcoin bulls have set their sights on $50,000 and this renewed push is also boosting large and small-cap altcoin prices."
2025-04-25,Axie Infinity hits a new ATH at $155 while Bitcoin bulls aim for $50K,"AXS, CVP and POLS lead altcoins higher while Bitcoin bulls search for a way to reclaim the $50,000 level.  "
2025-04-25,"Price analysis 10/1: BTC, ETH, ADA, BNB, XRP, SOL, DOT, DOGE, LUNA, UNI","Historical data suggests that October is a good month for Bitcoin bulls, and the push above $47,600 on Oct.1 could be a signal of what's to come for BTC and altcoins. "
2025-04-25,"Price analysis 9/29: BTC, ETH, ADA, BNB, XRP, SOL, DOT, DOGE, AVAX, UNI","A week-long pattern of daily lower highs suggests bulls will be unable to flip $43,000 to support and this could weigh on the fledgling recovery seen across many altcoins."
2025-04-25,Polkadot Web3 wallet Talisman closes $2.35M seed funding round,Talisman plans to release an early version of its Polkadot wallet extension before the end of November.
2025-04-25,"Price analysis 10/22: BTC, ETH, BNB, ADA, XRP, SOL, DOT, DOGE, LUNA, UNI","BTC and ETH reversed course as both assets search for underlying support, suggesting that bears are attempting to trap over-leveraged bulls. "
2025-04-25,"Price analysis 9/27: BTC, ETH, ADA, BNB, XRP, SOL, DOT, DOGE, AVAX, LUNA","Bitcoin and most major altcoins have recovered from last week’s sell-off, but they are still facing selling at higher levels, suggesting that the market could remain range-bound for a few days."
2025-04-25,"Price analysis 10/25: BTC, ETH, BNB, ADA, XRP, SOL, DOT, DOGE, LUNA, UNI","Bitcoin and several altcoins are attempting to resume their uptrend, but higher levels are likely to witness strong resistance from the bears."
2025-04-25,"Price analysis 10/27: BTC, ETH, BNB, ADA, SOL, XRP, DOT, DOGE, SHIB, LUNA",Bitcoin and Ether may witness a deeper pullback over the coming days and this move could shake weaker hands out of altcoins and other high risk positions.
2025-04-25,Institutional Bitcoin products tag record AUM despite volume pulling back,Institutional traders have locked $56 billion into Bitcoin investment products after inflows totaled $97.5 million last week. 
2025-04-25,"Price analysis 11/15: BTC, ETH, BNB, SOL, ADA, XRP, DOT, DOGE, SHIB, LUNA","Bitcoin and large-cap altcoins are meeting strong overhead resistance, which could be a signal that bears are attempting to stall the next upward move."
2025-04-25,"Price analysis 11/12: BTC, ETH, BNB, ADA, SOL, XRP, DOT, DOGE, SHIB, LUNA",Bearish pressures mount against Bitcoin price and this could lead to sharp short-term pullbacks in the prices of many altcoins.
2025-04-25,"Finance Redefined: ENS airdrops token, and SEC’s Crenshaw speaks on DeFi, Nov. 5–12 ","Ethereum Name Service issued its native token, an SEC commissioner published a DeFi opinion piece, and Polkadot’s parachains registered billions of dollars — all coming to you in this week’s Finance Redefined."
2025-04-25,Subsquid building decentralized indexing technology with new $3.8M funding,The company aims to develop a decentralized data query system following new funding.
2025-04-25,"Price analysis 11/10: BTC, ETH, BNB, ADA, SOL, XRP, DOT, DOGE, SHIB, LUNA","Bitcoin’s new all-time high at $69,000 and Ether’s slow climb toward $5,000 are clear signals that bulls are in control and a hint that altcoins intend to follow.  "
2025-04-25,Polkadot price moves higher as parachain auctions reduce DOT’s circulating supply ,DOT price targets new highs and investors expect the ongoing Polkadot parachain auctions to send the price on a trajectory that mirrors Kusama’s 2020 breakout.
2025-04-25,DeFi protocol Acala raises $400M in crowdloans during first Polkadot parachain auction,Both parachains on Polkadot and DeFi functions on Acala are still undergoing heavy development.  
2025-04-25,"Price analysis 11/8: BTC, ETH, BNB, ADA, SOL, XRP, DOT, SHIB, DOGE, AVAX",Bitcoin and Ethereum are taking full control of the market and technical analysis shows altcoins intend to keep pace with the top 2 cryptocurrencies.
2025-04-25,"Top 5 cryptocurrencies to watch this week: BTC, DOT, LUNA, AVAX, EGLD","Even as Bitcoin consolidates, DOT, LUNA, AVAX and EGLD may continue their upward journey."
2025-04-25,"Bitcoin retests support, with trader forecasting BTC price dip to $55K","The odds are on for a fresh Bitcoin price dip, and Ether may join in, analysis warns."
2025-04-25,Data shows Polkadot crashes after reaching $1B open interest — Will it happen again?,Polkadot (DOT) price crashed both times its futures open interest clipped $1 billion. Should traders expect a correction now that open interest is over this figure? 
2025-04-25,Cross-chain protocol links applications to the metaverse with Web 3.0,A protocol based on Polkadot leverages Web 3.0 to bridge the different blockchains into one decentralized metaverse.
2025-04-25,"Bitcoin reverses Tuesday gains, while Solana joins Ethereum in fresh all-time highs","Altcoins eat Bitcoin’s lunch on Wednesday, but confidence in an imminent Bitcoin rebirth is stronger than ever."
2025-04-25,"Is Polkadot eyeing $100 next? DOT price jumps 25%, triggering classic bullish chart pattern",The bullish outlook appears as Polkadot prepares to auction highly anticipated parachain slots on its network.
2025-04-25,"Bitcoin price consolidation ‘could be over,’ says trader as Ethereum, Polkadot hit all-time highs","A sea of green among altcoins comes as BTC/USD preserves its own gains, which have taken it past $63,000."
2025-04-25,"Upcoming parachain auctions send Polkadot to new ATH, while CHR and THETA follow","DOT hits a new all-time high as Polkadot’s parachain auctions approach, and the ever-expanding Metaverse could be behind the gains seen in CHR and THETA."
2025-04-25,"Price analysis 11/1: BTC, ETH, BNB, ADA, SOL, XRP, DOT, SHIB, DOGE, LUNA","Bitcoin and Ether closed October on a strong note, increasing the possibility that the rally will pick up pace in November."
2025-04-25,"Price analysis 10/29: BTC, ETH, BNB, ADA, SOL, XRP, DOT, DOGE, SHIB, LUNA",Ethereum is outperforming Bitcoin in the short-term and the strength of ETH in its USD and BTC pair could be a sign that the entire altcoin market is on the verge of a larger rally. 
2025-04-25,Polkadot-based DAO aims make decentralized governance more accessible,A decentralized autonomous organization is developing tools to make DAO-building more accessible as it dreams of a decentralized society.
2025-04-25,Is blockchain decentralized enough? This middleware provider doesn’t think so,A decentralized infrastructure service network says its goal is to tackle creeping centralization in the blockchain sector and give developers choice.
2025-04-25,Altcoin roundup: There’s more to DeFi than just providing liquidity,Bitcoin price is down but crypto investors still have a plethora of yield opportunities thanks to DeFi. 
2025-04-25,LCX price rallies 300%+ after the launching DeFi Terminal 2.0,"Increasing trading volume at Uniswap, a rising TVL and upgrades to its DeFi platform were followed by a new all-time high from LCX."
2025-04-25,Will Polkadot save decentralized finance from Ethereum’s scaling problems?,Polkadot may beat Ethereum 2.0 in the transaction fee race.
2025-04-25,"Price analysis 8/25: BTC, ETH, ADA, BNB, XRP, DOGE, DOT, SOL, UNI, BCH","Even with Wednesday's pullback, Bitcoin and most major altcoins are finding buyers on minor dips to underlying support levels, signaling that the trend remains bullish."
2025-04-25,"Price analysis 8/23: BTC, ETH, ADA, BNB, XRP, DOGE, DOT, SOL, UNI, BCH","Select altcoins are likely to move higher even as Bitcoin price takes a breather after hitting $50,000 for the first time in months."
2025-04-25,"Price analysis 8/20: BTC, ETH, ADA, BNB, XRP, DOGE, DOT, SOL, UNI, BCH","Bitcoin has resumed its move toward $50,000 and this is likely to send altcoin prices higher. "
2025-04-25,Kusama network set to launch its next five parachain auctions ,The Kusama Council is set to announce a further five parachain auctions after a successful $450 million TLV in the first round back of June 2021.
2025-04-25,Polkadot (DOT) price rallies 100% and derivatives data points to more upside,Strong fundamentals on the development side and derivatives data suggest that the DOT price could extend its 100% rally over the short-term. 
2025-04-25,"Price analysis 8/13: BTC, ETH, BNB, ADA, XRP, DOGE, DOT, UNI, SOL, LTC",The sharp rebound in Bitcoin and most major altcoins proves that traders are buying aggressively on every minor dip.
2025-04-25,"Price analysis 8/11: BTC, ETH, BNB, ADA, XRP, DOGE, DOT, UNI, LINK, SOL","Bitcoin and most major altcoins remain above their respective 200-day moving average, but the market's momentum will depend on whether BTC can pierce the $48,000 level."
2025-04-25,"Price analysis 8/6: BTC, ETH, BNB, ADA, XRP, DOGE, DOT, UNI, BCH, LINK","Bitcoin and most major altcoins are near critical overhead resistance levels, suggesting that the downtrend is very close to ending."
2025-04-25,"Price analysis 8/2: BTC, ETH, BNB, ADA, XRP, DOGE, DOT, UNI, BCH, LINK","Bitcoin price has hit a few barriers, but many altcoins appear positioned for continuation."
2025-04-25,"Price analysis 7/30: BTC, ETH, BNB, ADA, XRP, DOGE, DOT, UNI, BCH, LTC","Traders expect altcoins to move higher now that Bitcoin price finally pierced the $41,000 resistance.  "
